gene,snp,text
ABCA1,Rs2066714,Apolipoprotein E levels in cerebrospinal fluid and the effects of ABCA1 polymorphisms. Maternal and fetal variation in genes of cholesterol metabolism is associated with preterm delivery. Genetic-epidemiological evidence on genes associated with HDL cholesterol levels: a systematic in-depth review. Association of genetic variants with chronic kidney disease in Japanese individuals. A survey of ABCA1 sequence variation confirms association with dementia.
ABCA1,Rs2066715,Apolipoprotein E levels in cerebrospinal fluid and the effects of ABCA1 polymorphisms. Genetic-epidemiological evidence on genes associated with HDL cholesterol levels: a systematic in-depth review. A survey of ABCA1 sequence variation confirms association with dementia.
ABCA1,Rs2230806,"rs2230806, also known as Arg219Lys or R219K, is a SNP in the ABCA1 ATP-binding cassette, sub-family A (ABC1), member 1 gene. The rs2230806(G) allele encodes the arginine (R), and the (A) allele encodes the lysine (K).A meta-analysis published in 2011 comprising 22 studies with 6597 cases and 15,369 controls studied the association between the rs2230806 and risk for coronary artery disease. Overall, rs2230806(A) significantly associated with a higher HDL-C level in Asians and does lower the risk (odds ratio 0.76, CI: 0.68-0.85, p=3.78e-07) of coronary artery disease in Asians and Caucasians. ABCA1 modulates CSF cholesterol levels and influences the age at onset of Alzheimer's disease. Gender-specific association of ATP-binding cassette transporter 1 (ABCA1) polymorphisms with the risk of late-onset Alzheimer's disease. ABCA1 polymorphisms and Alzheimer's disease. Apolipoprotein E levels in cerebrospinal fluid and the effects of ABCA1 polymorphisms. The effect of ABCA1 gene polymorphisms on ischaemic stroke risk and relationship with lipid profile. Modifier effects between regulatory and protein-coding variation. Genetic-epidemiological evidence on genes associated with HDL cholesterol levels: a systematic in-depth review. A survey of ABCA1 sequence variation confirms association with dementia. Association of selected ABC gene family single nucleotide polymorphisms with postprandial lipoproteins: results from the population-based Hortega study. ABCA1 gene variants regulate postprandial lipid metabolism in healthy men. Increase in HDL-C concentration by a dietary portfolio with soy protein and soluble fiber is associated with the presence of the ABCA1R230C variant in hyperlipidemic Mexican subjects."
ABCA1,Rs2230808,"rs2297404, rs2230808, and rs2020927 haplotype (CAC) was more prevalent in the Alzheimer's disease group (0.323 in AD vs. 0.202 in control); while haplotype1 (TGG) was over-represented in the healthy controls (0.595 in control vs. 0.493 in AD) ABCA1 modulates CSF cholesterol levels and influences the age at onset of Alzheimer's disease. ABCA1 polymorphisms and Alzheimer's disease. Apolipoprotein E levels in cerebrospinal fluid and the effects of ABCA1 polymorphisms. The effect of ABCA1 gene polymorphisms on ischaemic stroke risk and relationship with lipid profile. Genetic-epidemiological evidence on genes associated with HDL cholesterol levels: a systematic in-depth review. A survey of ABCA1 sequence variation confirms association with dementia. A polymorphism of the ABCA1 gene confers susceptibility to schizophrenia and related brain changes."
ABCA1,Rs2297404,"rs2297404, rs2230808, and rs2020927 haplotype (CAC) was more prevalent in the Alzheimer's disease group (0.323 in AD vs. 0.202 in control); while haplotype1 (TGG) was over-represented in the healthy controls (0.595 in control vs. 0.493 in AD)"
ABCA1,Rs363717,Examining the effect of linkage disequilibrium between markers on the Type I error rate and power of nonparametric multipoint linkage analysis of two-generation and multigenerational pedigrees in the presence of missing genotype data. A survey of ABCA1 sequence variation confirms association with dementia.
ABCA1,Rs4149268,G allele is associated with 0.82mg/dl increase in HDL cholesterol (good cholesterol).
ABCA1,Rs4149274,C allele is associated with 1.51mg/dl increase in HDL cholesterol (good cholesterol).
ABCA7,Rs113809142,"rs113809142, also known as c.4416+2T>G, is one of several loss-of-function ABCA7 mutations associated with Alzheimer's disease initially in Icelanders, and then replicated in other populations.Carriers of one rare rs113809142(G) allele are at roughly more than twice the risk for developing late-onset Alzheimer's disease compared to people having the most common genotype (T;T); the odds ratio is 4.47, p=3.4 × 10e−7."
ABCA7,Rs115550680,"A 2013 meta-analysis comprising a total of ~2,000 African-Americans with late-onset Alzheimer's disease found that rs115550680(G) was associated with higher risk for the disorder in this population (OR 1.79, CI: 1.47-2.12, p = 2.2 × 10e-9). This SNP was is in (80-90%) linkage disequilibrium with SNPs previously associated with Alzheimer disease in Europeans.In 2016, a publication reported that a 44-base pair deletion (rs142076058) co-segregated with both Alzheimer's and rs115550680(G).This deletion is common in African-American Alzheimer cases (15.2%) and controls (9.74%), but is rare (0.12%) in a non-Hispanic white cohort. The deleted allele could result in defective protein function and be an ethnic-specific pathogenic alteration."
ABCA7,Rs200538373,"rs200538373, also known as c.5570+5G>C, is one of several loss-of-function ABCA7 mutations associated with Alzheimer's disease initially in Icelanders, and then replicated in other populations.Carriers of one rare rs200538373(C) allele are at roughly twice the risk for developing late-onset Alzheimer's disease compared to people having the most common genotype (G;G); the odds ratio is 1.91, p=3.8 × 10e−6."
ABCA7,Rs3764650,"Alzheimer's disease associated, based on large 2011 study ""The minor allele of Rs3764650 in ABCA7 was associated with a later age at onset and shorter disease course"" according to /"
ABCA7,Rs4147929,"rs4147929 is a SNP in the ATP-binding cassette, sub-family A (ABC1), member 7 ABCA7 gene.rs4147929 has been reported in a large study (IGAP) to be associated with late onset Alzheimer's disease.The risk allele (oriented to the dbSNP entry) is (A); the odds ratio associated with heterozygotes is 1.15 (CI 1.11-1.19),"
ABCA7,Rs72973581,"A sequencing study of 332 sporadic Alzheimer's disease cases identified this ABCA7 coding variant, rs72973581(A), also known as p.G215S, as conferring a modest but statistically significant protection against the disorder (OR 0.57, CI: 0.41-0.8, p = 0.024)."
ABCA7,Rs7408475,Alzheimer's disease polygenic hazard score
ABCA7,Rs78117248,"Sequencing of the ABCA7 gene in a Belgian cohort of 700+ patients with Alzheimer's disease led to the association of the rare rs78117248(G) allele with increased risk (odds ratio 2.07, CI: 1.31-3.27, p=0.0016)."
AANAT,Rs28936679,"rs28936679, also known as Ala129Thr or A129T (and also G619A), is a SNP in the aralkylamine N-acetyltransferase AANAT gene. The AANAT protein plays a unique role in vertebrate biology by controlling rhythmic production of melatonin in the pineal gland. Its activity increases 10- to 100-fold at night, leading to increased production and release of melatonin.In a 2003 report about Japanese patients with a sleep disorder known as susceptibility to delayed sleep phase syndrome, patient genotypes had a higher frequency of the rs28936679(A) allele.A later report based on Brazilian (primarily Caucasian) patients including those with delayed sleep phase syndrome found no variation at this SNP."
AANAT,Rs3760138,Genetic differences in human circadian clock genes among worldwide populations. Examination of association of genes in the serotonin system to autism.
AANAT,Rs4238989,Genetic differences in human circadian clock genes among worldwide populations.
