gene,snp,text
ABCB1,Rs10248420,"rs10248420 is a SNP in the ABCB1 gene (also known as the MDR1 gene), which encodes a protein that transports certain molecules across the blood-brain barrier. SNPs in ABCB1 may thus influence the intracerebral concentrations of certain drugs and their efficacy or potential for adverse side effects. However, the link between the increased brain concentrations of antidepressants and a clinically significant response is unconfirmed. In clinic, even the lower concentrations of drugs may achieve sufficient antidepressant effect, and the dose of the drug can be adjusted upwards until the patient responds. According to a recent review , ten studies reported that ABCB1 SNPs have clinical effect in depression and eight that they do not. rs10248420 is one of 9 SNPs found within a tight linkage block (r<sup>2</sup> >= 0.8 ) such that the minor allele at any one of them predicts (with ~80%+ accuracy) that the other SNPs will also be the minor allele. The list of the 9 SNPs is shown below.When treated for depression with citalopram, paroxetine, amitriptyline, or venlafaxine (substrates of the protein encoded by ABCB1), a highly statistically significant association between the overall genetic variability of these SNPs and remission was reported by Uhr et al in a study of ~400 German inpatients.. However, this result has to be treated with caution. A well-run, double-blind study of ABCB1 substrate citalopram in depression (STAR-D study) and a following meta-analysis  failed to replicate several Uhr et al. results for other ABCB1 SNPs.The 9 SNPs in the linkage block identified are :* rs2235067* rs4148740* rs2032583* rs4148739* rs11983225* rs2235040* rs12720067* rs7787082* rs10248420 rs10248420 and rs2032583 associated with colonic disease Identifying candidate causal variants responsible for altered activity of the ABCB1 multidrug resistance gene."
ABCB1,Rs1045642,"rs1045642, also known as C3435T, is a SNP located in the ABCB1 gene. It is often studied in conjunction with rs2032582. C3435T has been mentioned by:*  A ""Silent"" Polymorphism in the MDR1 Gene Changes Substrate Specificity (for example, to verapamil)*  (R)-lansoprazole (Prevacid) concentrations are significantly increased in CYP2C19 extensive metabolizers with ABCB1 C3435T C allele.*  In a Korean population, plasma concentrations of fexofenadine (Allegra) were 17% lower in 2677AA/3435CC subjects and 47% higher in the 2677TT/3435TT subjects compared to 2677GG/3435CC subjects.*  In contrast, in this study no association was observed between the C3435T polymorphism and fexofenadine plasma or urine concentrations in a German Caucasian population.*  A meta-analysis including 9 case-control studies (totaling ~2,500 patients) found no association between rs1045642 and epilepsy riskA study of 98 methadone-maintaining patients concluded that the higher (>150 mg/day) and lower (< or =150 mg/day) methadone dose groups differed significantly in their rs1128503 status (experiment-wise p = 0.0325). Furthermore, individuals with the 3-locus genotype pattern (T;T)-(T;T)-(T;T) for SNPs rs1045642, rs2032582 and rs1128503, respectively, had an approximately 5-fold chance of requiring the 'higher' methadone dose, while individuals heterozygous for these three SNPs have an approximately 3-fold chance of stabilizing at the 'lower' methadone dose (point-wise p-value = 0.026). Identifying candidate causal variants responsible for altered activity of the ABCB1 multidrug resistance gene. Genetic predictors of the maximum doses patients receive during clinical use of the anti-epileptic drugs carbamazepine and phenytoin. ABCB1 genotypes and haplotypes in patients with dementia and age-matched non-demented control patients. Association of MDR1 genotypes with susceptibility to colorectal cancer in older non-smokers. Genetic studies of a cluster of acute lymphoblastic leukemia cases in Churchill County, Nevada. MDR1 gene variants, indoor insecticide exposure, and the risk of childhood acute lymphoblastic leukemia. No association between MDR1 (ABCB1) 2677G>T and 3435C>T polymorphism and sporadic colorectal cancer among Bulgarian patients. ABCB1 (MDR1) gene polymorphisms are associated with the clinical response to paroxetine in patients with major depressive disorder. Pharmacogenetics of minimal residual disease response in children with B-precursor acute lymphoblastic leukemia: a report from the Children's Oncology Group. Multiplexed genotyping of ABC transporter polymorphisms with the Bioplex suspension array. A PAI-1 (SERPINE1) polymorphism predicts osteonecrosis in children with acute lymphoblastic leukemia: a report from the Children's Oncology Group. Association of ABCB1 genetic variants with renal function in Africans and in Caucasians. Genotyping panel for assessing response to cancer chemotherapy. Polymorphisms affecting gene transcription and mRNA processing in pharmacogenetic candidate genes: detection through allelic expression imbalance in human target tissues. Bidirectional translational research: Progress in understanding addictive diseases. The pharmacokinetics and pharmacogenomics of efavirenz and lopinavir/ritonavir in HIV-infected persons requiring hemodialysis. No association of ABCB1 polymorphisms with drug-refractory epilepsy in a north Indian population. Germline genetic variations in drug action pathways predict clinical outcomes in advanced lung cancer treated with platinum-based chemotherapy. Prevalence in the United States of selected candidate gene variants: Third National Health and Nutrition Examination Survey, 1991-1994. Opiate and cocaine addiction: from bench to clinic and back to the bench. Investigation of candidate polymorphisms and disease activity in rheumatoid arthritis patients on methotrexate. Steroid biosynthesis and renal excretion in human essential hypertension: association with blood pressure and endogenous ouabain. Genetic determinants of target and novelty-related event-related potentials in the auditory oddball response. ABCB1 (MDR1) rs1045642 is associated with increased overall survival in plasma cell myeloma. No significant effect of ABCB1 haplotypes on the pharmacokinetics of fluvastatin, pravastatin, lovastatin, and rosuvastatin. Influence of ABCB1 polymorphisms and haplotypes on tacrolimus nephrotoxicity and dosage requirements in children with liver transplant. Polymorphisms in the xenobiotic transporter Multidrug Resistance 1 (MDR1) and interaction with meat intake in relation to risk of colorectal cancer in a Danish prospective case-cohort study. Effect of CYP3A and ABCB1 single nucleotide polymorphisms on the pharmacokinetics and pharmacodynamics of calcineurin inhibitors: Part I. Effect of CYP3A and ABCB1 single nucleotide polymorphisms on the pharmacokinetics and pharmacodynamics of calcineurin inhibitors: Part II. Explaining variability in ciclosporin exposure in adult kidney transplant recipients. Pazopanib-induced hyperbilirubinemia is associated with Gilbert's syndrome UGT1A1 polymorphism. ABCB1/MDR1 gene polymorphisms as a prognostic factor in colorectal cancer. ABCB1 gene polymorphisms are associated with the severity of major depressive disorder and its response to escitalopram treatment. Cytochrome P450 genetic polymorphisms influence the serum concentration of calcineurin inhibitors in allogeneic hematopoietic SCT recipients. Pharmacogenetics of antidepressant response. Correlation between genetic polymorphisms of the hOCT1 and MDR1 genes and the response to imatinib in patients newly diagnosed with chronic-phase chronic myeloid leukemia. Impact of ABCB1 C3435T polymorphism on lymph node regression in multimodality treatment of locally advanced esophageal cancer. Ultra-resistant schizophrenia is not associated with the multidrug-resistant transporter 1 (MDR1) gene rs1045642 variant. The effects of CYP3A4, CYP3A5, ABCB1, ABCC2, ABCG2 and SLCO1B3 single nucleotide polymorphisms on the pharmacokinetics and pharmacodynamics of docetaxel in nasopharyngeal carcinoma patients. Expression of CYP3A5 and P-glycoprotein in renal allografts with histological signs of calcineurin inhibitor nephrotoxicity. Polymorphisms of the MDR1 and MIF genes in children with nephrotic syndrome. The clinical impact of ABCB1 polymorphisms on the treatment of psychiatric diseases. Association of ABCB1, 5-HT3B receptor and CYP2D6 genetic polymorphisms with ondansetron and metoclopramide antiemetic response in Indonesian cancer patients treated with highly emetogenic chemotherapy. Polymorphisms in genes that regulate cyclosporine metabolism affect cyclosporine blood levels and clinical outcomes in patients who receive allogeneic hematopoietic stem cell transplantation. Common variants in ABCB1, ABCC2 and ABCG2 genes and clinical outcomes among women with advanced stage ovarian cancer treated with platinum and taxane-based chemotherapy: a Gynecologic Oncology Group study. ABCB1 haplotype is associated with major molecular response in chronic myeloid leukemia patients treated with standard-dose of imatinib. Variants in ABCB1, TGFB1, and XRCC1 genes and susceptibility to viral hepatitis A infection in Mexican Americans. Influence of genomic ancestry on the distribution of SLCO1B1, SLCO1B3 and ABCB1 gene polymorphisms among Brazilians. Association between the functional polymorphism (C3435T) of the gene encoding P-glycoprotein (ABCB1) and major depressive disorder in the Japanese population. MDR1 C3435T polymorphism and cancer risk: a meta-analysis based on 39 case-control studies. A comprehensive investigation on common polymorphisms in the MDR1/ABCB1 transporter gene and susceptibility to colorectal cancer. Neither P-gp SNP variants, P-gp expression nor functional P-gp activity predicts MDR in a preliminary study of plasma cell myeloma. PharmGKB summary: phenytoin pathway."
ABCB1,Rs1128503,"rs1128503 is a SNP in the transporter P-glycoprotein (P-gp) 170, encoded by the ABCB1 (also known as MDR1) gene. Methadone is a substrate of this protein, so variants may affect the efficacy and optimal dosage of this drug as used for treating opiate dependence.A study of 98 methadone-maintaining patients concluded that the higher (>150 mg/day) and lower (< or =150 mg/day) methadone dose groups differed significantly in their rs1128503 status (experiment-wise p = 0.0325). Furthermore, individuals with the 3-locus genotype pattern (T;T)-(T;T)-(T;T) for SNPs rs1045642, rs2032582 and rs1128503, respectively, had an approximately 5-fold chance of requiring the 'higher' methadone dose, while individuals heterozygous for these three SNPs have an approximately 3-fold chance of stabilizing at the 'lower' methadone dose (point-wise p-value = 0.026). Identifying candidate causal variants responsible for altered activity of the ABCB1 multidrug resistance gene. ABCB1 genotypes and haplotypes in patients with dementia and age-matched non-demented control patients. MDR1 gene variants, indoor insecticide exposure, and the risk of childhood acute lymphoblastic leukemia. ABCB1 (MDR1) gene polymorphisms are associated with the clinical response to paroxetine in patients with major depressive disorder. Multiplexed genotyping of ABC transporter polymorphisms with the Bioplex suspension array. Genotyping panel for assessing response to cancer chemotherapy. Polymorphisms affecting gene transcription and mRNA processing in pharmacogenetic candidate genes: detection through allelic expression imbalance in human target tissues. Bidirectional translational research: Progress in understanding addictive diseases. No association of ABCB1 polymorphisms with drug-refractory epilepsy in a north Indian population. Opiate and cocaine addiction: from bench to clinic and back to the bench. Genetic determinants of target and novelty-related event-related potentials in the auditory oddball response. No significant effect of ABCB1 haplotypes on the pharmacokinetics of fluvastatin, pravastatin, lovastatin, and rosuvastatin. Influence of ABCB1 polymorphisms and haplotypes on tacrolimus nephrotoxicity and dosage requirements in children with liver transplant. Sequence variations of ABCB1, SLC6A2, SLC6A3, SLC6A4, CREB1, CRHR1 and NTRK2: association with major depression and antidepressant response in Mexican-Americans. Effect of CYP3A and ABCB1 single nucleotide polymorphisms on the pharmacokinetics and pharmacodynamics of calcineurin inhibitors: Part I. Effect of CYP3A and ABCB1 single nucleotide polymorphisms on the pharmacokinetics and pharmacodynamics of calcineurin inhibitors: Part II. Explaining variability in ciclosporin exposure in adult kidney transplant recipients. Pazopanib-induced hyperbilirubinemia is associated with Gilbert's syndrome UGT1A1 polymorphism. ABCB1/MDR1 gene polymorphisms as a prognostic factor in colorectal cancer. Cytochrome P450 genetic polymorphisms influence the serum concentration of calcineurin inhibitors in allogeneic hematopoietic SCT recipients. Pharmacogenetics of antidepressant response. Polymorphisms of the MDR1 and MIF genes in children with nephrotic syndrome. Association of ABCB1, 5-HT3B receptor and CYP2D6 genetic polymorphisms with ondansetron and metoclopramide antiemetic response in Indonesian cancer patients treated with highly emetogenic chemotherapy. Polymorphisms in genes that regulate cyclosporine metabolism affect cyclosporine blood levels and clinical outcomes in patients who receive allogeneic hematopoietic stem cell transplantation. ABCB1 haplotype is associated with major molecular response in chronic myeloid leukemia patients treated with standard-dose of imatinib. Influence of genomic ancestry on the distribution of SLCO1B1, SLCO1B3 and ABCB1 gene polymorphisms among Brazilians. Association between the functional polymorphism (C3435T) of the gene encoding P-glycoprotein (ABCB1) and major depressive disorder in the Japanese population. PharmGKB summary: phenytoin pathway."
ABCB1,Rs11983225,"rs11983225 is a SNP in the ABCB1 gene (also known as the MDR1 gene), which encodes a protein that transports certain molecules across the blood-brain barrier. SNPs in ABCB1 may thus influence the intracerebral concentrations of certain drugs and their efficacy or potential for adverse side effects. However, the link between the increased brain concentrations of antidepressants and a clinically significant response is unconfirmed. In clinic, even the lower concentrations of drugs may achieve sufficient antidepressant effect, and the dose of the drug can be adjusted upwards until the patient responds. According to a recent review , ten studies reported that ABCB1 SNPs have clinical effect in depression and eight that they do not. rs11983225 is one of 9 SNPs found within a tight linkage block (r<sup>2</sup> >= 0.8 ) such that the minor allele at any one of them predicts (with ~80%+ accuracy) that the other SNPs will also be the minor allele. The list of the 9 SNPs is shown below.When treated for depression with citalopram, paroxetine, amitriptyline, or venlafaxine (substrates of the protein encoded by ABCB1), a highly statistically significant association between the overall genetic variability of these SNPs and the remission was reported by Uhr et al in a study of ~400 German inpatients. However, the result for rs11983225 has to be treated with caution. A well-run, double-blind study of ABCB1 substrate citalopram in depression (STAR-D study) and a following meta-analysis  failed to replicate several Uhr et al. results for other ABCB1 SNPs in this block.The 9 SNPs in the linkage block identified are :* rs2235067* rs4148740* rs2032583* rs4148739* rs11983225* rs2235040* rs12720067* rs7787082* rs10248420 Identifying candidate causal variants responsible for altered activity of the ABCB1 multidrug resistance gene."
ABCB1,Rs12720067,"rs12720067 is a SNP in the ABCB1 gene (also known as the MDR1 gene), which encodes a protein that transports certain molecules across the blood-brain barrier. SNPs in ABCB1 may thus influence the intracerebral concentrations of certain drugs and their efficacy or potential for adverse side effects. However, the link between the increased brain concentrations of antidepressants and a clinically significant response is unconfirmed. In clinic, even the lower concentrations of drugs may achieve sufficient antidepressant effect, and the dose of the drug can be adjusted upwards until the patient responds. According to a recent review , ten studies reported that ABCB1 SNPs have clinical effect in depression and eight that they do not. rs12720067 is one of 9 SNPs found within a tight linkage block (r<sup>2</sup> >= 0.8 ) such that the minor allele at any one of them predicts (with ~80%+ accuracy) that the other SNPs will also be the minor allele. The list of the 9 SNPs is shown below.When treated for depression with citalopram, paroxetine, amitriptyline, or venlafaxine (substrates of the protein encoded by ABCB1), a highly statistically significant association between the overall genetic variability of these SNPs and the remission was reported by Uhr et al in a study of ~400 German inpatients. However, the result for rs12720067 has to be treated with caution. A large (900 subjects) well-run, double-blind study of ABCB1 substrate citalopram in depression (STAR-D study) and a following meta-analysis  failed to replicate several Uhr et al. results for other ABCB1 SNPs in this block.The 9 SNPs in the linkage block identified are :* rs2235067* rs4148740* rs2032583* rs4148739* rs11983225* rs2235040* rs12720067* rs7787082* rs10248420"
ABCB1,Rs2032582,"rs2032582, also known as G2677T, is a nonsynonymous SNP located in exon 21 of the ABCB1 gene. G2677 is also known as Ala893Thr. It is often studied in conjunction with rs1045642.The rs2032582(T) variant allele yields a 2.6 fold higher risk of developing lung cancer, and in particular, the type of lung cancer called squamous cell carcinoma (CI 1.7-4.0, P < .001) in white Spanish smokers. There appears to be little gene dosage effect, since homozygous rs2032582(T;T) carriers shoulder almost all the risk (odds ratio 6.75 compared to (A;A) homozygotes, CI 3.0-15.2). This risk is also the same in light or heavy smokers.  A study of 98 methadone-maintaining patients concluded that the higher (>150 mg/day) and lower (< or =150 mg/day) methadone dose groups differed significantly in their rs1128503 status (experiment-wise p = 0.0325). Furthermore, individuals with the 3-locus genotype pattern (T;T)-(T;T)-(T;T) for SNPs rs1045642, rs2032582 and rs1128503, respectively, had an approximately 5-fold chance of requiring the 'higher' methadone dose, while individuals heterozygous for these three SNPs have an approximately 3-fold chance of stabilizing at the 'lower' methadone dose (point-wise p-value = 0.026).OMIM also reports an association with Crohn's disease."
ABCB1,Rs2032583,"rs2032583 is a SNP in the ABCB1 gene (also known as the MDR1 gene), which encodes a protein that transports certain molecules across the blood-brain barrier. SNPs in ABCB1 may thus influence the intracerebral concentrations of certain drugs and their efficacy or potential for adverse side effects. Clinical studies on antidepressant drug dosage, plasma medication levels and treatment outcome suggest monotonic associations for tricyclic antidepressant drugs  and threshold models or higher order relationships for selective serotonin reuptake inhibitors  and newer antidepressant drugs ,. However, the link between the increased brain concentrations of antidepressants and a clinically significant response is to be confirmed. A study of ~400 of German psychiatric inpatients with depression conducted in 2007 by Uhr et al  found that rs2032583(C) carriers treated with ABCB1 substrates had better chances on remission. However,could not be reproduced in a large (~900) -trial with outpatient with major depression treated with the ABCB1 substrate citalopram (STAR-D study, level 1). According to a recent meta analysis , the significant association of antidepressant treatment outcome among all studies with this SNP becomes insignificant after Bonferroni correction for multiple comparisons. However, the association remained significant after Bonferroni-correction in a subgroup-analysis of all inpatients.rs2032583 is one of 9 SNPs found within a tight linkage block (r<sup>2</sup> >= 0.8 ) such that the minor allele at any one of them predicts (with ~80%+ accuracy) that the other SNPs will also be the minor allele. The 9 SNPs in the linkage block identified are :* rs2235067* rs4148740* rs2032583* rs4148739* rs11983225* rs2235040* rs12720067* rs7787082* rs10248420In contrast,  reported on two SNPs from the block, rs2032583 and rs2235040, that these SNPs are close to Hardy–Weinberg equilibrium (not inherited together) in their 81% white population. Other results from  are unreliable because they picked an antidepressant sertraline, which is, likely, not an ABCB1 substrate , as an example of an ABCB1 substrate and treated a majority of patients in the study with it.  rs10248420 and rs2032583 associated with colonic disease"
ABCB1,Rs2235015,"rs2235015 is a SNP in the ABCB1 gene (also known as the MDR1 gene), which encodes a protein (P-glycoprotein - Pgp) that transports certain molecules across the blood-brain barrier. SNPs in ABCB1 may thus influence the intracerebral concentrations of certain drugs and their efficacy or potential for adverse side effects. Clinical studies on antidepressant drug dosage, plasma medication levels and treatment outcome suggest monotonic associations for tricyclic antidepressant drugs  and threshold models or higher order relationships for selective serotonin reuptake inhibitors PMID 28648553 and newer antidepressant drugs ,.  However, the link between the increased brain concentrations of antidepressants and a clinically significant response is still to be confirmed. According to a recent review , ten studies reported that ABCB1 SNPs have clinical effect on depression outcome and eight - that they do not. However those 18 studies are difficult to compare because they vary within their study design concerning following factors: population (ethnicity, psychiatric condition), tested SNPs, tested antidepressants (Pgp substrates and Pgp non-substrates) and doses, inclusion of drug metabolism monitoring and statistical correction for multiple testing.A study of ~400 of German psychiatric inpatients with depression conducted in 2007 by Uhr et al  found that rs2235015(T) carriers treated with ABCB1 substrates were more likely to remit. However, this result could not be reproduced in a large (N~900) trial with outpatients with major depression treated with the ABCB1 substrate citalopram (STAR-D study, level 1). According to a recent meta analysis , no significant association of antidepressant treatment outcome with this SNP among all studies, but the association remained significant in a subgroup-analysis of all inpatients. rs2235015 is near the 9 SNPs found within a tight linkage block (r<sup>2</sup> >= 0.8 ) such that the minor allele at any one of them predicts (with ~80%+ accuracy) that the other SNPs will also be the minor allele. The list of the 9 SNPs is shown below. rs2235015 has an r<sup>2</sup> value of >0.5 with this group :* rs2235067* rs4148740* rs2032583* rs4148739* rs11983225* rs2235040* rs12720067* rs7787082* rs10248420"
ABCB1,Rs2235035,C allele linked to colorectal cancers Identifying candidate causal variants responsible for altered activity of the ABCB1 multidrug resistance gene. Polymorphisms in multidrug resistance 1 (MDR1) gene are associated with refractory Crohn disease and ulcerative colitis.
ABCB1,Rs2235040,"rs2235040 is a SNP in the ABCB1 gene (also known as the MDR1 gene), which encodes a protein that transports certain molecules across the blood-brain barrier. SNPs in ABCB1 may thus influence the intracerebral concentrations of certain drugs and their efficacy or potential for adverse side effects. However, the link between the increased brain concentrations of antidepressants and a clinically significant response is unconfirmed. In clinic, even the lower concentrations of drugs may achieve sufficient antidepressant effect, and the dose of the drug can be adjusted upwards until the patient responds. According to a recent review , ten studies reported that ABCB1 SNPs have clinical effect in depression and eight - that they do not.A study of ~400 of German psychiatric inpatients with depression conducted in 2007 by Uhr et al.  found that rs2235040(A) carriers treated with ABCB1 substrates were more likely to remit. However, this result failed to reproduce in a large (900 outpatient subjects) and better designed double-blind study of a well-researched ABCB1 substrate citalopram in depression (STAR-D study). According to a recent meta analysis , no significant association of antidepressant treatment outcome with this SNP. There was a significant association with treatment outcome in the inpatients subsample but data regarding rs2235040 and treatment outcome among inpatients entirely stemmed from the study by Uhr et al.The 9 SNPs in the linkage block identified are :* rs2235067* rs4148740* rs2032583* rs4148739* rs11983225* rs2235040* rs12720067* rs7787082* rs10248420In contrast,  reported on two SNPs from the block, rs2032583 and rs2235040, that these SNPs are in a weak disequilibrium (not always inherited together) in their 81% white population. Other results from  are unreliable because the authors used an antidepressant sertraline, which is, likely, not an ABCB1 substrate , as an example of an ABCB1 substrate and treated most of the patients in the study with sertraline."
