gene,snp,text
ABCB1,Rs2235067,"rs2235067 is a SNP in the ABCB1 gene (also known as the MDR1 gene), which encodes a protein that transports certain molecules across the blood-brain barrier. SNPs in ABCB1 may thus influence the intracerebral concentrations of certain drugs and their efficacy or potential for adverse side effects. However, the link between the increased brain concentrations of antidepressants and a clinically significant response is unconfirmed. In clinic, even the lower concentrations of drugs may achieve sufficient antidepressant effect, and the dose of the drug can be adjusted upwards until the patient responds. According to a recent review , ten studies reported that ABCB1 SNPs have clinical effect in depression and eight that they do not.rs2235067 is one of 9 SNPs found within a tight linkage block (r<sup>2</sup> >= 0.8 ) such that the minor allele at any one of them predicts (with ~80%+ accuracy) that the other SNPs will also be the minor allele. The list of the 9 SNPs is shown below.When treated for depression with citalopram, paroxetine, amitriptyline, or venlafaxine (substrates of the protein encoded by ABCB1), a highly statistically significant association between the overall genetic variability of these SNPs and the remission was reported by Uhr et al in a study of ~400 German inpatients. However, the result for rs2235067  has to be treated with caution. A well-run, double-blind study of ABCB1 substrate citalopram in depression (STAR-D study) and a following meta-analysis  failed to replicate several Uhr et al. results for other ABCB1 SNPs in this block.The 9 SNPs in the linkage block identified are :* rs2235067* rs4148740* rs2032583* rs4148739* rs11983225* rs2235040* rs12720067* rs7787082* rs10248420 ABCB1 (MDR1) genetic variants are associated with methadone doses required for effective treatment of heroin dependence."
ABCB1,Rs3789243,"A Danish case-control study comprising 373 Crohn's disease and 541 ulcerative colitis patients (and 796 healthy controls) concluded that carriers of the homozygous COX-2 and MDR1 intron 3 variant (rs3789243) had a relatively high risk of CD, odds ratio (95% CI) (OR (95% CI))=2.86 ((1.34-5.88) p=0.006) and 1.39 ((0.99-1.92) p=0.054), respectively, and for UC of 2.63 ((1.33-5.26) p=0.005) and 1.28 ((0.96-1.51) p=0.093), respectively, assuming complete dominance."
ABCB1,Rs3842,"rs3842 (A;G) and (G;G) was associated with increased risk of developing lung cancer (odds ratio OR. 1.36; 95% confidence interval 95% CI, 1.06-1.76), especially in women (2.5x)rs212090(A;T) (T;T) increased cancer susceptibility (OR, 1.37; 95% CI, 1.03-1.83)"
ABCB1,Rs4148739,"rs4148739 is a SNP in the ABCB1 gene (also known as the MDR1 gene), which encodes a protein that transports certain molecules across the blood-brain barrier. SNPs in ABCB1 may thus influence the intracerebral concentrations of certain drugs and their efficacy or potential for adverse side effects. However, the link between the increased brain concentrations of antidepressants and a clinically significant response is unconfirmed. In clinic, even the lower concentrations of drugs may achieve sufficient antidepressant effect, and the dose of the drug can be adjusted upwards until the patient responds. According to a recent review , ten studies reported that ABCB1 SNPs have clinical effect in depression and eight that they do not.rs4148739 is one of 9 SNPs found within a tight linkage block (r<sup>2</sup> >= 0.8 ) such that the minor allele at any one of them predicts (with ~80%+ accuracy) that the other SNPs will also be the minor allele. The list of the 9 SNPs is shown below.When treated for depression with citalopram, paroxetine, amitriptyline, or venlafaxine (substrates of the protein encoded by ABCB1), a highly statistically significant association between the overall genetic variability of these SNPs and the remission was reported by Uhr et al in a study of ~400 German inpatients. However, this result has to be treated with caution. A well-run, double-blind study of ABCB1 substrate citalopram in depression (STAR-D study) and a following meta-analysis  failed to replicate several Uhr et al. results for other ABCB1 SNPs.The 9 SNPs in the linkage block identified are :* rs2235067* rs4148740* rs2032583* rs4148739* rs11983225* rs2235040* rs12720067* rs7787082* rs10248420"
ABCB1,Rs4148740,"is a SNP in the ABCB1 gene (also known as the MDR1 gene), which encodes a protein that transports certain molecules across the blood-brain barrier. SNPs in ABCB1 may thus influence the intracerebral concentrations of certain drugs and their efficacy or potential for adverse side effects. However, the link between the increased brain concentrations of antidepressants and a clinically significant response is unconfirmed. In clinic, even the lower concentrations of drugs may achieve sufficient antidepressant effect, and the dose of the drug can be adjusted upwards until the patient responds. According to a recent review , ten studies reported that ABCB1 SNPs have clinical effect in depression and eight that they do not. rs4148740 is one of 9 SNPs found within a tight linkage block (r<sup>2</sup> >= 0.8 ) such that the minor allele at any one of them predicts (with ~80%+ accuracy) that the other SNPs will also be the minor allele. The list of the 9 SNPs is shown below.When treated for depression with citalopram, paroxetine, amitriptyline, or venlafaxine (substrates of the protein encoded by ABCB1), a highly statistically significant association between the overall genetic variability of these SNPs and the remission was reported by Uhr et al in a study of ~400 German inpatients. However, the result for rs4148740 has to be treated with caution. A well-run, double-blind study of ABCB1 substrate citalopram in depression (STAR-D study) and a following meta-analysis  failed to replicate several Uhr et al. results for other ABCB1 SNPs in this block.The 9 SNPs in the linkage block identified are :* rs2235067* rs4148740* rs2032583* rs4148739* rs11983225* rs2235040* rs12720067* rs7787082* rs10248420"
ABCB1,Rs7787082,"rs7787082 is a SNP in the ABCB1 gene (also known as the MDR1 gene), which encodes a protein that transports certain molecules across the blood-brain barrier. SNPs in ABCB1 may thus influence the intracerebral concentrations of certain drugs and their efficacy or potential for adverse side effects. However, the link between the increased brain concentrations of antidepressants and a clinically significant response is unconfirmed. In clinic, even the lower concentrations of drugs may achieve sufficient antidepressant effect, and the dose of the drug can be adjusted upwards until the patient responds. According to a recent review , ten studies reported that ABCB1 SNPs have clinical effect in depression and eight that they do not.  rs7787082 is one of 9 SNPs found within a tight linkage block (r<sup>2</sup> >= 0.8 ) such that the minor allele at any one of them predicts (with ~80%+ accuracy) that the other SNPs will also be the minor allele. The list of the 9 SNPs is shown below.When treated for depression with citalopram, paroxetine, amitriptyline, or venlafaxine (substrates of the protein encoded by ABCB1), a highly statistically significant association between the overall genetic variability of these SNPs and the remission was reported by Uhr et al in a study of ~400 German inpatients. However, the result for rs7787082 has to be treated with caution. A well-run, double-blind study of ABCB1 substrate citalopram in depression (STAR-D study) and a following meta-analysis  failed to replicate several Uhr et al. results for other ABCB1 SNPs in this block.The 9 SNPs in the linkage block identified are :* rs2235067* rs4148740* rs2032583* rs4148739* rs11983225* rs2235040* rs12720067* rs7787082* rs10248420"
ABCC2,Rs2273697,"rs2273697, also known as c1249G>A or p.V471I, is a nonsynonymous polymorphism in the ABCC2 gene.From an initial case-control study of 146 patients with epilepsy, followed by replication (p=0.001) in another 279 patients, the rs2273697(A) allele was associated with neurological adverse drug reactions from taking carbamazepine. Functional studies showed that this SNP selectively reduced carbamazepine transport across the cell membrane."
ABCC2,Rs3740065,"rs3740065 is a SNP in the ATP-binding cassette, sub-family C (CFTR/MRP), member 2 ABCC2 gene.A study of 282 hormone receptor-positive, invasive breast cancer Japanese patients receiving tamoxifen found a significant association with shorter recurrence-free survival (p = .00017; hazard ratio 10.64, CI: 1.44 - 78.88) in rs3740065(T;T) patients; the hazard ratio for carriers of one (T) allele was 3.5 (CI: 0.5-26). Curiously, no significant difference in plasma levels of the tamoxifen metabolites endoxifen or 4-hydroxytamoxifen were seen.This same study of tamoxifen users concluded that rs3740065(T;T) patients who also had two CYP2D6 risk alleles had a 45 fold higher risk of recurrence than patients with zero or one (out of the possible four) risk alleles. The overall average recurrence risk was 5x for carriers of a total of two risk alleles, and 20x for carriers of a total of three risk alleles.A nearby SNP, rs11190303, also showed significant association to recurrence-free survival; it was shown to be strongly linked to rs3740065 (r2 with LD of 0.79)."
ABCC2,Rs3740066,"rs3740066, a SNP in the ABCC2 gene, is reported to be associated with a higher risk of developing intrahepatic cholestasis of pregnancy (ICP) based on a study of ~70 Argentinian patients. ICP is associated with increased fetal risks such as premature birth or intrauterine death.The risk allele is rs3740066(A), and the odds ratio for homozygous rs3740066(A;A) mothers is 4.44 (CI: 1.83 - 10.78), and for heterozygous mothers 1.65 (CI: 0.76 - 3.64), compared to rs3740066(G;G) mothers."
ABCC2,Rs717620,"Association of the multidrug-resistance-associated protein gene (ABCC2) variants with intrahepatic cholestasis of pregnancy. Polymorphisms of MRP2 (ABCC2) are associated with susceptibility to nonalcoholic fatty liver disease. MRP2 and GSTP1 polymorphisms and chemotherapy response in advanced non-small cell lung cancer. Genetic polymorphisms influence mycophenolate mofetil-related adverse events in pediatric heart transplant patients. ADME pharmacogenetics: investigation of the pharmacokinetics of the antiretroviral agent lopinavir coformulated with ritonavir. Interindividual variability in hepatic expression of the multidrug resistance-associated protein 2 (MRP2/ABCC2): quantification by liquid chromatography/tandem mass spectrometry. A comprehensive study of polymorphisms in ABCB1, ABCC2 and ABCG2 and lung cancer chemotherapy response and prognosis."
ABCC4,Rs11568658,"The human multidrug resistance protein 4 (MRP4, ABCC4): functional analysis of a highly polymorphic gene. Analysis of 17,576 potentially functional SNPs in three case-control studies of myocardial infarction."
ABCC4,Rs9561778,"rs9561778 is a SNP in the ATP-binding cassette, sub-family C (CFTR/MRP), member 4 ABCC4 gene.A stepwise case-control study of ~400 breast cancer Japanese patients receiving cyclophosphamide-based combination chemotherapy, roughly divided equally between those having or not having serious adverse drug reactions (ADRs), concluded that carriers of rs9561778(T) allele had a ~2x higher risk of ADRs. The ADRs for these patients tended to be gastrointestinal toxicity and leukopenia/neutropenia."
ABCC8,I5008233,Familial Hyperinsulinism (ABCC8-related)/
ABCC8,I5012556,Familial Hyperinsulinism (ABCC8-related)/
ABCC8,I5012558,Familial Hyperinsulinism (ABCC8-related)/
ABCC8,Rs1048095,"rs1048095, also known as L225P, Leu225Pro and 674T>C, is a rare variant in the ATP-binding cassette, sub-family C (CFTR/MRP), member 8 ABCC8 gene.Heterozygous carriers for this SNP are reported to have permanent neonatal diabetes mellitus (PNDM). It was also reported that patients have been successfully treated with oral sulfonylureas."
ABCC8,Rs137852672,aka c.560T>A (p.Val187Asp or V187D)
ABCC8,Rs137852676,"Pharmacokinetics of glaphenine in subjects with normal renal function and in patients with chronic renal insufficiency. Preoperative evaluation of infants with focal or diffuse congenital hyperinsulinism by intravenous acute insulin response tests and selective pancreatic arterial calcium stimulation. Genotype-phenotype associations in patients with severe hyperinsulinism of infancy. Permanent neonatal diabetes caused by dominant, recessive, or compound heterozygous SUR1 mutations with opposite functional effects. Effective treatment with oral sulfonylureas in patients with diabetes due to sulfonylurea receptor 1 (SUR1) mutations. Neonatal diabetes mellitus."
ABCC8,Rs151344623,"aka c.3992-9G>AThis variant is considered a founder mutation in Ashkenazi Jews, where the combined carrier frequency of this variant and rs151344624 is reported to be 1 in 52, giving an estimated frequency of homozygosity or compound heterozygosity of 1 in 10,816 in this population. The risk of focal CHI is 1 in 540 per pregnancy in offspring of carrier fathers because there can be somatic loss of heterozygosity causing the focal form of the disease. OMIM"
ABCC8,Rs151344624,"aka c.4163_4165delTCT (p.Phe1388del)This variant is considered a founder mutation in Ashkenazi Jews, where the combined carrier frequency of this variant and rs151344623 is reported to be 1 in 52, giving an estimated frequency of homozygosity or compound heterozygosity of 1 in 10,816 in this population. The risk of focal CHI is 1 in 540 per pregnancy in offspring of carrier fathers because there can be somatic loss of heterozygosity causing the focal form of the disease. OMIM"
ABCA3,Rs1278044377,aka c.316C>T
ABCA3,Rs149989682,"rs149989682, also known as c.875A>T, p.Glu292Val and E292V, represents a rare mutation in the ABCA3 gene on chromosome 16.Inherited as an autosomal recessive, the rs149989682(A) allele - as oriented in dbSNP orientation - is considered pathogenic in ClinVar (and BabySeq) for surfactant metabolism dysfunction, pulmonary, type 3, a disorder involving severe neonatal distress that often results in the death of a newborn within the first month.Note potential for ambiguous flip confusion."
ABCC11,Rs17822931,"rs17822931, also known as c.538G>A or G180R, is a SNP in the ATP-binding cassette, sub-family C (CFTR/MRP), member 11 ABCC11 gene. The ABCC11 protein helps transport small molecules across apical membranes such as those in apocrine secretory cells.  This SNP determines wet vs dry earwax as well as sweat production, and it is also associated with lipid secretion. It is commonly (T;T) for East Asians and (C;C) for Europeans and Africans. A study of deodorant usage in a large (17,000+) population showed that rs17822931(T;T) individuals were at least 5-fold less likely to use deodorant, consistent with them being ""genotypically nonodorous"". Although not statistically significant, there was some evidence for a heterozygote effect, implying that individuals with a (C;C) genotype for this SNP were likely to use deodorant at a higher frequency than (C;T) genotypes. gnxp indicates this SNP influences risk of breast cancer in Japanese women. This does not hold true in Caucasian women, though./ reddit discussion"
ABCC6,Rs212077,"A systems genetics approach implicates USF1, FADS3, and other causal candidate genes for familial combined hyperlipidemia."
ABCC6,Rs63749796,Novel ABCC6 mutations in pseudoxanthoma elasticum.
ABCC6,Rs63749823,A spectrum of ABCC6 mutations is responsible for pseudoxanthoma elasticum.
ABCC9,Rs11046205,"A K(ATP) channel gene effect on sleep duration: from genome-wide association studies to function in Drosophila. rs11046205 explains ~5% of the variation in sleep duration. The A allele was associated with longer sleep duration, while the G allele was associated with shorter sleep duration."
ABCC9,Rs11046232,Genes controlling postural changes in blood pressure: comprehensive association analysis of ATP-sensitive potassium channel genes KCNJ8 and ABCC9. In haplotype rs2900492(G)-rs11046232(A)-rs4148649(A)-rs4762865(A) associated with postural changes in blood pressure.
ABCC9,Rs2900492,Genes controlling postural changes in blood pressure: comprehensive association analysis of ATP-sensitive potassium channel genes KCNJ8 and ABCC9. rs2900492(G) associated with postural changes in blood pressure. Also in haplotypes rs2900492(A)-rs2955503(A) and rs2900492(G)-rs11046232(A)-rs4148649(A)-rs4762865(A) associated with postural changes in blood pressure.
ABCC9,Rs2955503,Genes controlling postural changes in blood pressure: comprehensive association analysis of ATP-sensitive potassium channel genes KCNJ8 and ABCC9. rs2955503(A) associated with postural changes in blood pressure. Also in haplotype rs2900492(A)-rs2955503(A) associated with postural changes in blood pressure.
ABCC9,Rs4148649,Genes controlling postural changes in blood pressure: comprehensive association analysis of ATP-sensitive potassium channel genes KCNJ8 and ABCC9. In haplotype rs2900492(G)-rs11046232(A)-rs4148649(A)-rs4762865(A) associated with postural changes in blood pressure.
ABCC9,Rs4762865,Genes controlling postural changes in blood pressure: comprehensive association analysis of ATP-sensitive potassium channel genes KCNJ8 and ABCC9. In haplotype rs2900492(G)-rs11046232(A)-rs4148649(A)-rs4762865(A) associated with postural changes in blood pressure.
ABCB4,Rs45575636,"rs45575636, also known as c.1769G>A, p.Arg590Gln and R590Q, represents a variant in the ABCB4 gene on chromosome 7.The clinical significance of the quite rare rs45575636(A) allele is reported as ""uncertain"" in ClinVar. This variant has been reported though to place a woman at between 2-fold to 16-fold higher risk for intrahepatic cholestasis of pregnancy, according to separate papers cited in OMIM  171060.0012."
ABCB4,Rs58238559,"aka c.523A>G (p.Thr175Ala)Based on a 2015 study of <100 patients, individuals carrying a rs58238559(C) allele have a 3.75-fold increase in the probability of developing atrial fibrillation/flutter."
ABCD1,Rs1057517954,"aka c.488G>A (p.Arg163His), c.488G>T (p.Arg163Leu) and c.488G>C (p.Arg163Pro), all of which are reported as pathogenic"
ABCD1,Rs1057518721,"aka c.107C>A (p.Ser36Ter)Reported in ClinVar as associated with Chromosome Xq28 deletion syndrome; hemizygous mutation in the BCAP31 gene can lead to deafness, dystonia, and cerebral hypomyelination (DDCH)"
ABCD1,Rs1064793877,aka c.1895C>T (p.Thr632Ile)
ABCD1,Rs1131691743,"aka c.761C>T (p.Thr254Met) and c.761C>A (p.Thr254Lys), both of which are pathogenic for adrenoleukodystrophy according to the  ALD Mutation Database"
ABCD1,Rs193922094,"aka c.1592T>C (p.Leu531Pro)Reported in ClinVar as pathogenic for adrenoleukodystrophy (ALD); however, this mutation is not listed in the  ALD Mutation Database"
ABCD1,Rs387906494,c.1415_1416delAG (p.Gln472Argfs)
ABCD1,Rs387906496,c.871_873delGAG (p.Glu292del)
ABCD1,Rs387906497,c.-18_8del26 (p.Met1_Gly66del)
ABCD1,Rs398123103,aka c.1586G>A (p.Gly529Asp)
ABCD1,Rs398123104,"aka c.1660C>A (p.Arg554Ser)Reported in ClinVar as pathogenic for adrenoleukodystrophy (ALD); however, this variant is not listed in the  ALD Mutation Database"
ABCD1,Rs398123109,aka c.31_46del16 (p.Arg11Serfs)Reported in ClinVar as pathogenic for adrenoleukodystrophy (ALD)
ABCD1,Rs398123110,aka c.346G>A (p.Gly116Arg or G116R)
ABCD1,Rs398123111,aka c.406C>T (p.Gln136Ter)
ABCD1,Rs398123112,c.498_520del23 (p.Val167Leufs)
ABCD1,Rs398123113,aka c.614C>A (p.Ala205Glu)Note that c.614C>T is listed as a variant of uncertain significance in the  ALD Mutation Database
ABCG2,Rs1481012,A gene-wide investigation on polymorphisms in the ABCG2/BRCP transporter and susceptibility to colorectal cancer.
ABCG2,Rs2199936,"Meta-analysis of 28,141 individuals identifies common variants within five new loci that influence uric acid concentrations."
ABCG2,Rs2231137,"rs2231137, also known as Val12Met, is a SNP in the ATP-binding cassette, sub-family G (WHITE), member 2 ABCG2 gene. The (G) allele encodes the Val.In a study of incident ischemic stroke during 14 years of follow-up in a population-based study of older adults known as the Cardiovascular Health Study (CHS), rs2231137 was associated with stroke in both white (hazard ratio, 1.46, CI: 1.05 - 2.03) and black (hazard ratio, 3.59, CI, 1.11 - 11.6) participants. The risk of ischemic stroke was higher in Val allele homozygotes than in Met allele carriers. The adjusted hazard ratio for Val allele homozygotes, compared with Met allele carriers, was 1.50 (90% CI, 1.06 to 2.12) in whites and 3.62 (90% CI, 1.11 to 11.9) in black participants (Table 4). Because nearly 90% of whites and blacks are Val homozygotes, the Met allele could also be considered as a protective allele."
ABCG2,Rs2231142,"rs2231142, also known as Q141K and C421A, is a SNP in the ABCG2 gene, indicating a missense variant.  ""Our data indicate that at least 10% of all gout cases in whites are attributable to this causal variant.""A is the risk allele. A large study totaling 7,699 participants in the Framingham cohort and 4,148 participants in the Rotterdam cohort was conducted, with genome-wide significant SNPs then replicated in 11,000+ Caucasian and ~4,000 African-American individuals who took part in the study of Atherosclerosis Risk in Communities (ARIC). This study calculated an odds ratio of 1.74 for rs2231142 (CI: 1.51-1.99, p = 3.3x10e-15). A genetic score comprised of this SNP plus 2 others may stratify risk for gout. Among non-small cell lung cancer patients treated with gefitinib, there's a 4-5x higher risk of diarrhea for rs2231142 heterozygotes (and presumably minor allele homozygotes), based on a study of 124 patients treated with 250mg oral gefitinib once daily.rs2231142 also appears to influence the effectiveness of rosuvastatin. A study of 305 Chinese patients concluded that rs2231142(A;A) individuals showed a 7% greater reduction in LDL-C levels, equivalent to a doubling of the dose.See also: / 23andMe blog gout"
ABCG2,Rs3114018,"rs3114018(C), a variant in the ABCG2 gene, was the most significantly associated with gout in a 2017 study of ~200 Han Chinese patients (OR 3.19, CI:2.24–4.55, p=6.1x10e-11). This study also defined 5 haplotype blocks associated with gout."
ABCG2,Rs72552713,"rs72552713, also known as Gln126Ter, is a SNP in the ABCG2 gene.gout association in a Japanese population, based on ; note that this publication refers to risk allele (T) based on the minus strand, whereas for dbSNP and SNPedia, rs72552713 is defined as on the plus strand, so therefore the risk allele is (A).The case-control analysis of 1993 patients with gout and 1334 controls concluded that rs72552713(A) was significantly associated with gout (odds ratio 2.86, CI:2.1-3.8,p=4.4x10e-12). The risk is independent of the risk posed by another ABCG2 gene SNP, rs2231142, since these two SNPs are on different haplotypes. Both ABCG2 SNPs are, however, associated with the ROL gout subtype, defined as when urinary urate excretion (UUE) is over 25.0 mg/h/1.73 m2 (600 mg/day/1.73 m2) and urate clearance (urate clearance/creatinine clearance ratio, FEUA) is 5.5% or over."
ABCA12,Rs28940268,"This is a recessive SNP for congenital Lamellar ichthyosis, type 2, also called ichthyosis-4A, a significant skin condition."
ABCA12,Rs28940269,"This is a recessive SNP for congenital Lamellar ichthyosis, type 2, also called ichthyosis-4A, a significant skin condition."
ABCA12,Rs28940270,"This is a recessive SNP for congenital Lamellar ichthyosis, type 2, also called ichthyosis-4A, a significant skin condition."
ABCA12,Rs28940271,"This is a recessive SNP for congenital Lamellar ichthyosis, type 2, also called ichthyosis-4A, a significant skin condition."
ABCA12,Rs28940568,"This is a recessive SNP for congenital Lamellar ichthyosis, type 2, also called ichthyosis-4A, a significant skin condition."
ABCA12,Rs726070,"aka c.7093G>A (p.Asp2365Asn)The variant allele was reported over a decade ago as being a recessive mutation associated with a form of ichthyosis; however, more recent annotations have come to the conclusion that it is actually likely to be benign, in part since it's seen far more frequently than would be expected given how rare the actual condition is."
ABCA1,Rs1800977,"The -14C->T polymorphism rs1800977 of the ABCA1 gene was significantly associated with atherothrombotic cerebral infarction in a study of 3,400+ Japanese adults."
ABCA1,Rs1883025,Apolipoprotein E levels in cerebrospinal fluid and the effects of ABCA1 polymorphisms. Analysis of recently identified dyslipidemia alleles reveals two loci that contribute to risk for carotid artery disease. Investigation of variants identified in caucasian genome-wide association studies for plasma high-density lipoprotein cholesterol and triglycerides levels in Mexican dyslipidemic study samples. Genome-wide association of lipid-lowering response to statins in combined study populations. Genetic variants near TIMP3 and high-density lipoprotein-associated loci influence susceptibility to age-related macular degeneration. Genome-wide association study of advanced age-related macular degeneration identifies a role of the hepatic lipase gene (LIPC).
ABCA1,Rs2020927,"rs2297404, rs2230808, and rs2020927 haplotype (CAC) was more prevalent in the Alzheimer's disease group (0.323 in AD vs. 0.202 in control); while haplotype1 (TGG) was over-represented in the healthy controls (0.595 in control vs. 0.493 in AD) Effect of ABCA1 variant on atherogenic dyslipidaemia in patients with Type 2 diabetes treated with rosiglitazone."
