gene	snp	context
PPARG	Rs6802898	Associated with type-2 diabetes.
PPARG	Rs4684847	Associated with at least one mortality outcome in a study of ~10,000 individuals.Based on the same study (but a different publication) : Associated with baseline body mass and blood pressure in a study of 9,000+ individuals in Washington County, Maryland.
PPARG	Rs4135247	Associated with risk of lung cancer in a Chinese population.
PPARG	Rs28936407	NOTE: the OMIM entry cited below refers to a somatic mutation, not a germline SNP.
PPARG	Rs2292101	Genome-wide association with diabetes-related traits in the Framingham Heart Study.
PPARG	Rs1899951	Associated with risk of lung cancer in a Chinese population.
PPARG	Rs1801282	A ten-year study of 679 male patients with symptomatic coronary artery disease found that rs1801282 (G) carriers had a much lower (10 year) cardiovascular risk, with the hazard ratio estimated to be 0.10 (CI: 0.01-0.70, p = 0.02) for ischemic heart disease and 0.24 for vascular death (CI: 0.08-0.74, p = 0.013) per copy of the allele./ 23andMe blog carriers could be informed that they really need to watch out for high fat in their dietsResponse to Diet and Exercise.
PPARG	Rs17036314	rs17036314 is a SNP in the peroxisome proliferator-activated receptor gamma PPARG gene.In a 4 year study of 479 overweight individuals with impaired glucose tolerance (IGT) who participated in the Finnish Diabetes Prevention Study (DPS), carrying a rs17036314 (C) allele predicted conversion to type-2 diabetes (T2D) after adjustment for baseline fasting glucose (p=0.030).
PPARG	Rs13073869	Associated with risk of lung cancer in a Chinese population Effects of the type 2 diabetes-associated PPARG P12A polymorphism on progression to diabetes and response to troglitazone.
PPARG	Rs1151996	PPARG by dietary fat interaction influences bone mass in mice and humans.
PPARG	Rs2197423	Associated with type-2 diabetes.
PPARGC1A	Rs2290602	rs2290602 is a SNP in the PPARGC1A gene that has been associated with nonalcoholic fatty liver disease (NAFLD).
PPARGC1A	Rs2290602	Association between PPARGC1A polymorphisms and the occurrence of nonalcoholic fatty liver disease (NAFLD).
PPARGC1A	Rs2970848	Localization of sequence variations in PGC-1alpha influence their modifying effect in Huntington disease.
PPARGC1A	Rs7665116	PGC-1alpha as modifier of onset age in Huntington disease.
PPARGC1A	Rs7665116	A greatly extended PPARGC1A genomic locus encodes several new brain-specific isoforms and influences Huntington disease age of onset.
PPARGC1B	Rs251468	This SNP is associated to freckles.
PPP1CB	Rs1114167429	OMIM pathogenic.
PPP2R5D	Rs863225082	PPP2R5D gene, aka c.592G>A, p.Glu198Lys and E198KConsidered to be a de novo (dominant) missense variant associated with intellectual disability, macrocephaly, hypotonia, and autism; see ClinVar and as well as links on PPP2R5D page.
PPP2R5D	Rs863225079	PPP2R5D gene, aka c.598G>A, p.Glu200Lys and E200KConsidered to be a de novo (dominant) missense variant associated with intellectual disability, macrocephaly, hypotonia, and autism; see ClinVar and as well as links on PPP2R5D page.
PPP2R5D	Rs863225081	PPP2R5D gene, aka c.589G>A, p.Glu197Lys, and E197KConsidered to be a de novo (dominant) missense variant associated with intellectual disability, macrocephaly, hypotonia, and autism; see ClinVar and as well as links on PPP2R5D page.
PPT1	I5012622	Neuronal ceroid lipofuscinosis (PPT1-related) rs137852696.
PPT1	I5012623	Neuronal ceroid lipofuscinosis (PPT1-related) rs137852695.
PPT1	I5012624	Neuronal ceroid lipofuscinosis (PPT1-related) rs137852700.
PPT1	Rs137852695	Neuronal ceroid lipofuscinosis (PPT1-related).
PPT1	Rs137852696	Neuronal ceroid lipofuscinosis (PPT1-related).
PRF1	Rs104894182	C.836G>A (p.Cys279Tyr) 23andMe name: i5000833.
PRF1	Rs28933374	C.1034C>T (p.Pro345Leu).
PRKAG2	Rs28938173	Familial hypertrophic cardiomyopathysee also OMIM 602743.0004.
PRKCA	Rs4790904	It has been linked to memory capacity in healthy subjects and to risk for post-traumatic stress disorder Risk allele is A..
PRKCH	Rs3783782	One of 42 more SNPs associated with rheumatoid arthritis based on a meta-analysis of 30,000 patients, most with odds ratios of 1.01 - 1.2.
PRKCH	Rs3783799	Association of PRKCH gene with lacunar infarction in a local Chinese Han population.
PRM1	Rs35576928	Low-frequency protamine 1 gene transversions c.102G->T and c.-107G->C do not correlate with male infertility Mutations in the protamine 1 gene associated with male infertilityMale Infertility.
PRNP	Rs11538758	The mutant variant has a low likelihood (p=0.00-0.02), but leads to neurodegeneration after approximately age 50, although symptoms and onset can be highly variable.
PRNP	Rs16990018	However, more recent research has indicated that the N171S variant is present in healthy members of numerous populations, reaching penetrance of 11% in Biaka Pygmies and 5% in Jamaicans.
PRNP	Rs1799990	rs1799990 (A;G) heterozygotes were significantly overrepresented (age-adjusted odds ratio, 8.47) in 39 individuals with primary progressive aphasia (PPA), a rare condition of unknown cause, compared to 400+ controls.
PRNP	Rs28933385	Age and origin of the PRNP E200K mutation causing familial Creutzfeldt-Jacob disease in Libyan Jews.
PROC	Rs121918145	C.629C>T (p.Pro210Leu) 23andMe name: i5003629.
PROC	Rs121918148	Aka c.185A>C (p.Glu62Ala) 23andMe name: i5003626.
PROC	Rs121918154	Aka c.814C>T (p.Arg272Cys) 23andMe name: i5003620.
PROC	Rs146922325	Aka c.565C>T, p.Arg189Trp, R189WThe rs146922325 (T) mutation may be the most frequent pathogenic variant associated with venous thromboembolism in East Asian (including Chinese) populations.
PROC	Rs2069912	The rs2069912 (C) allele is associated with severe sepsis and thus increased risk of death and organ dysfunction based on a study of 100 North American East Asians.
PROC	Rs369504169	: low anticoagulant activity observed for variant.
PRODH	Rs4819756	Plos () - The minor alleles of rs4819756 and rs2870983 were significantly negatively associated with schizophrenia.
PRODH	Rs450046	Executive function, neural circuitry, and genetic mechanisms in schizophrenia.
PRODH	Rs450046	Functional polymorphisms in PRODH are associated with risk and protection for schizophrenia and fronto-striatal structure and function.
PRODH	Rs450046	Also referred to as 1766A/G plos rs450046 was most strongly positively associated with schizophrenia in families.
PRODH	Rs2870983	Plos The minor alleles of rs4819756 and rs2870983 were significantly negatively associated with schizophrenia.
PRODH	Rs450046	Structural cerebral variations as useful endophenotypes in schizophrenia: do they help construct extended endophenotypes?.
PROM1	Rs796051882	Non-coding variant assessed as part of Blueprint Genetics Retinal dystrophy (266 gene) panel.
PROS1	Rs1131691605	Two variants are represented by this SNP: c.1156-1G>A, and, c.1156-1G>T.
PROS1	Rs121918472	Aka c.1501T>C (p.Ser501Pro or S501P) The minor allele of this SNP, rs121918472 (C), leads to a Protein S form known as the Heerlen variant.
PROS1	Rs138925964	rs138925964, also known as c.1528G>A, p.Val510Met and V510M, represents a fairly rare mutation in the PROS1 gene on chromosome 3.Based on exome sequencing, a 2016 report concludes that the rs138925964 (T) allele is an African-descent specific risk factor for venous thromboembolism, also known as VTE.
PRRC2A	Rs3132453	rs3132453, a SNP in the BAT2 gene also known as V1883L, is associated with reduced risk for developing Non-Hodgkin Lymphoma based on a study of 458 patients.
PRRC2A	Rs1046089	rs1046089 is a SNP in the HLA-B associated transcript 2 BAT2 gene.A study of 2,162 case-controls found an association between rs1046089 and severe malaria.
PRSS1	Rs144422014	The minor allele, rs144422014 (G), is classified as pathogenic for hereditary pancreatitis in ClinVar, a condition associated with dominant or de novo mutations.
PRSS1	Rs397507441	Aka c.63_71dupTGACAAGAT (p.Ile24_Val25insAspLysIle).
PRSS1	Rs111033565	Hereditary pancreatitis is caused by a mutation in the cationic trypsinogen gene.
PRSS1	Rs111033566	Populations that are mostly healthy and where the incidence of pancreatitis is quite low).Specifically, numerous publications, ClinVar, and the Pancreas Genetics database all state that the N29I/N29T mutation is dominant and pathogenic (for hereditary pancreatitis).However, allele frequencies reported in dbSNP, taken from ExAC/gnomAD, for the rs111033566 (T) allele are around 26-47%, a frequency too high to be a pathogenic mutation for a rare condition.
PSEN1	Rs63750218	rs63750218, also known as L392P or Leu392Pro, is a SNP in the presenilin 1 PSEN1 gene.The rare rs63750218 (C) allele is reported as a pathogenic mutation for Alzheimers disease.
PSEN1	Rs63750227	C.1225G>A (p.Ala409Thr).
PSEN1	Rs63750083	There is an alternate allele, c.1292C>T, however the medical consequence if any is not currently reported.As described initially in 2006 in families from the Jalisco region of Mexiso, the rs63750083 (A) variant is considered a founder mutation for early-onset Alzheimers disease.
PSEN1	Rs63750231	rs63750231 consists of at least two known mutations, and so this SNP is also known as both c.839A>C, p.Glu280Ala and E280A, as well as c.839A>G, p.Glu280Gly and E280G.
PSEN1	Rs63750004	rs63750004, also known as c.428T>A, Ile143Asn and I143D, and also c.428T>C, Ile143Thr or I143T, is a SNP in the presenilin 1 PSEN1 gene.Inherited as an autosomal dominant, the rare rs63750004 (A) and rs63750004 (C) alleles are both considered pathogenic for early-onset Alzheimers disease in AlzForum.Both are reported in to be a definitely pathogenic mutation.
PSEN1	Rs63750299	rs63750299, also known as c.518T>G, L173W or Leu173Trp, is a SNP in the presenilin 1 PSEN1 gene.Inherited as an autosomal dominant, the rare rs63750299 (G) allele is considered pathogenic for early-onset Alzheimers disease according to AlzForum.Reported in to be a definitely pathogenic mutation.
PSEN1	Rs63750301	C.791C>T (p.Pro264Leu) Atypical presentation of Alzheimers; see AlzForum.
PSEN1	Rs63750307	rs63750307, also known as DellM, I83_M84del, and c.247_252delATCATG, represents a mutation in the PSEN1 gene on chromosome 14.This deletion, located in exon 4 of the PSEN1 gene, is considered to be a dominant mutation pathogenic for early-onset Alzheimers disease.,See also: AlzForum.
PSEN1	Rs63750231	More information about this mutation can be found in OMIM 104311.0010.This SNP is referred to as i5047571 by 23andMe, and it is reported to assay the A/G form of this SNP (and not the A/C).
PSEN1	Rs63749911	rs63749911, also known as c.529T>C, F177L or Phe177Leu, is a SNP in the presenilin 1 PSEN1 gene.Inherited as an autosomal dominant, the rare rs63749911 (C) allele is considered pathogenic for Alzheimers disease according to AlzForum.Reported in to be a definitely pathogenic mutation.Although Promethease statistics do not currently show evidence that 23andMe is obviously prone to miscalling this mutation, an example of such an error (i.e.
PSEN1	Rs63749962	Inherited as an autosomal dominant, both the rare rs63749962 (C) and rs63749962 (G) alleles are considered pathogenic for early-onset Alzheimers disease according to AlzForum.Reported in to be a definitely pathogenic mutation.
PSEN1	Rs63749885	rs63749885, also known as H163Y or His163Tyr, is a SNP in the presenilin 1 PSEN1 gene.Inherited as an autosomal dominant, the rare rs63749885 (T) allele is considered pathogenic for early-onset Alzheimers disease.
PSEN1	I3002721	PRO436GLN in PSEN1 (i3002721, CC is usual) onset Alzheimers disease rs121917808.
PSEN1	I5047571	See discussion at rs63750231 The rs63750231 (G) and (C) alleles are both reported to be rare dominant mutations leading to early-onset Alzheimers disease.
PSEN1	I5047580	PSEN1 gene mutation potentially associated with early-onset Alzheimers disease rs63750083.
PSEN1	Rs17125721	They are trying to discover why at least a third of people with Alzheimers disease do not have the an APO E4 allele, and why some people who are homozygotes for APO E4 do not get the disease.
PSEN1	I5047571	rs63750231 early-onset Alzheimers disease.This is 23andMes name for rs63750231.
PSEN1	Rs3025786	rs3025786 is a SNP in the presenilin 1 PSEN1 gene.A study of a Spanish case-control sample of 1,183 individuals showed rs3025786 was associated with Alzheimers disease in an ApoE-specific manner: more specifically rs3025786 (C) allele carriers have a decreased AD risk among carriers of the ApoE4 allele.
PSEN1	Rs63749805	rs63749805, also known as c.350C>T, P117L or Pro117Leu, is a SNP in the presenilin 1 PSEN1 gene.Inherited as an autosomal dominant, the rare rs63749805 (T) allele is considered pathogenic for early-onset Alzheimers disease according to AlzForum.23andMe name for the c.350C>T version of this SNP: i5047529The c.350C>A (p.Pro117Gln) variant of this SNP is reported in to be a definitely pathogenic mutation.
PSEN1	Rs63749824	rs63749824, also known as c.236C>T, A79V or Ala79Val, is a SNP in the presenilin 1 PSEN1 gene.Inherited as an autosomal dominant, the rare rs63749824 (T) allele is considered pathogenic for late-onset Alzheimers disease.Reported in to be a definitely pathogenic mutation.
PSEN1	Rs28930977	Dementia, SPASTIC PARAPARESIS, APRAXIA,.
PSEN2	Rs63750048	rs63750048, also known as c.254C>T, A85V or Ala85Val, is a SNP in the presenilin 2 PSEN2 gene.Inherited as an autosomal dominant, the rare rs63750048 (T) allele is reported to lead to an atypical early-onset Alzheimers disease.
PSEN2	Rs63750812	rs63750812, also known as V148I or Val148Ile, is a SNP in the presenilin PSEN2 gene.Inherited as an autosomal dominant, the rare rs63750812 (A) allele is reported to be causative for early-onset Alzheimers disease.
PSEN2	Rs63750666	However, a sibling who shared this mutation with an Alzheimers patient did not show signs of early-onset disease, so this mutation may have reduced penetrance.
PSEN2	Rs63750215	rs63750215, also known as c.422A>T, N141I or Asn141Ile, is a SNP in the presenilin 2 PSEN2 gene.Inherited as an autosomal dominant, the rare rs63750215 (T) allele is considered causative for early-onset Alzheimers disease; see.
PSEN2	Rs63750197	rs63750197, also known as S130L or Ser130Leu, is a SNP in the presenilin 2 PSEN2 gene.Although based on small numbers of patients, the rare rs63750197 (T) allele has been reported to be associated with both Alzheimers disease and a form of dilated cardiomyopathy., However, the Alzheimer pathogenicity is considered unclear, and while the evidence for involvement with dilated cardiomyopathy evidence is strong, the condition has incomplete penetrance.
PSEN2	Rs63750110	rs63750110, also known as c.1316A>C, D439A or Asp439Ala, represent a very rare variant in the presenilin 2 PSEN2 gene.Inherited as an autosomal dominant, the rare rs63750110 (C) allele was reported in 2001/2002 as causative for early-onset Alzheimers disease; see.More recent studies (in 2015 and 2016) are casting doubt on the penetrance of this mutation.
PSEN2	Rs63749884	rs63749884, also known as c.717G>A, M239I or Met239Ile, is a SNP in the presenilin 2 PSEN2 gene.Inherited as an autosomal dominant, the rare rs63749884 (A) allele is considered causative for early-onset Alzheimers disease; see.
PSEN2	Rs28936379	rs28936379, also known as c.715A>G, M239V or Met239Val, is a SNP in the presenilin 2 PSEN2 gene.Inherited as an autosomal dominant, the rare rs28936379 (G) allele is considered causative for early-onset Alzheimers disease.This mutation is also reported as pathogenic in ClinVar, AlzForum and listed as definitely pathogenic in.
PSEN2	Rs533813519	Aka c.505C>A, p.His169Asn or H169NThe rare rs533813519 (C) mutation in the PSEN2 gene was observed in a female Korean patient with early-onset Alzheimers disease and was considered to be associated and most likely inherited in an autosomal dominant manner.
PSEN2	Rs367855127	rs367855127, also known as c.712C>T, p.Leu238Phe and L238F, is a variant in the PSEN2 gene on chromosome 10.The rs367855127 (T) variant was found in a single individual diagnosed with early-onset Alzheimers disease and with no family history of the disorder.
PSEN2	Rs28936380	rs28936380, also known as T122R or Thr122Arg, is a SNP in the presenilin 2 PSEN2 gene.Inherited as an autosomal dominant, the rare rs28936380 (G) allele is considered causative for early-onset Alzheimers disease.23andMe calls this i5007545.
PSEN2	Rs755101354	Aka c.482A>G, p.Lys161Arg rs755101354, also known as c.482A>G, K161R or Lys161Arg, is a SNP in the presenilin 2 PSEN2 gene.Inherited as an autosomal dominant, the rare rs755101354 (G) allele is considered causative for early-onset Alzheimers disease according to two publications cited in AlzForum including.The mutation is also considered possibly pathogenic for early-onset Alzheimers disease in.
PSEN2	Rs200754713	rs200754713, also known as c.692A>G, Y231C or Tyr231Cys, is a SNP in the presenilin 2 PSEN2 gene.The rare rs200754713 (G) allele is considered pathogenic as an autosomal dominant for Frontotemporal dementia; a patient with this allele was described as exhibiting behavioral abnormalities and language impairment.. See also AlzForum.
PSEN2	Rs1800680	A SNP in the PSEN2 gene.
PSEN2	Rs150400387	The rs150400387 (T) allele is reported in a 49 year old Korean patient as being pathogenic, as also predicted by structural calculations.However, the AlzForum database, which does tabulate at least 4 individuals with Alzheimers carrying this mutation, concludes that the pathogenicity remains unclear.
PSEN2	Rs61761208	rs61761208, also known as c.421A>T, N141Y or Asn141Tyr, is a mutation in the presenilin 2 PSEN2 gene.The minor allele is reported as pathogenic for early-onset Alzheimers disease in the AlzForum database, based on a 2014 publication.
PSEN2	Rs775145486	rs775145486, also known as c.524C>G, S175C or Ser175Cys, is a SNP in the presenilin 2 PSEN2 gene.Reported in the AlzForum database as pathogenic for Alzheimers disease, based on the 2010 publication.Note that the 23andMe name for this mutation is i5047676.
PSG2	Rs707746	Exome Sequencing Identifies FUS Mutations as a Cause of Essential Tremor... Functional considerations suggest that the pathogenic effects of ET-specific FUS mutations are different from the effects observed when FUS is mutated in amyotrophic lateral sclerosis cases; we have shown that the ET FUS nonsense mutation is degraded by the nonsense-mediated-decay pathway, whereas amyotrophic lateral sclerosis FUS mutant transcripts are not...This snp was flagged as Suspect: Variation suspected to be false positive due to artifacts of the presence of a paralogous sequence in the genome (Musumeci et al.
PTEN	Rs1057520900	PTEN gene, c.675T>G (p.Tyr225Ter). pathogenic in ClinVar for PTEN hamartoma tumor syndromenote c.675T>C is likely to be a benign variant according to ClinVar.
PTEN	Rs1060500116	Note that the truncation observed in a patient suspected of having Cowden syndrome in this publication was not a c.176C>G mutation (it was c.176C>A), but both mutations result in a stop codon and a truncated protein.23andMe name: i6017222.
PTGS1	Rs10306114	rs10306114, also known as -842A>G, is a SNP upstream of the cyclooxygenase-1 PTGS1 gene.A study of 696 European patients undergoing elective diagnostic coronary angiographies (CAGs) because of suspected or proven stable coronary artery disease found that 23 experienced bleeding, perhaps the most common complication of this type of invasive coronary procedure.
PTGS2	Rs4648261	/ news rs4648261 was linked with a reduction in colorectal cancer risk of between 40 to 68 percent.
PTGS2	Rs5275	Influence of COX-2 and OXTR polymorphisms on treatment outcome in treatment resistant depression.
PTGS2	Rs689465	Polymorphisms in cycloxygenase-2 gene and breast cancer prognosis: association between PTGS2 haplotypes and histopathological features.
PTGS2	Rs689469	Pyrosequencing of polymorphisms in the COX-2 gene (PTGS2) with reported clinical relevance.
PTPN11	Rs12229892	Associations of a PTPN11 G/A polymorphism at intron 3 with Helicobactor pylori seropositivity, gastric atrophy and gastric cancer in Japanese.
PTPN2	Rs514000	Implicated in a 2015 Korean cohort for Crohns disease.
PTPN2	Rs1893217	Crohns disease-associated polymorphism within the PTPN2 gene affects muramyl-dipeptide-induced cytokine secretion and autophagy.
PTPN2	Rs2542151	rs2542151 has been reported in a large study to be associated with Crohns disease.The risk allele (oriented to the dbSNP entry) is (G). the odds ratio associated with heterozygotes is 1.3 (CI 1.14-1.48), and for homozygotes, 2.01 (CI 1.46-2.76).
PTPN22	Rs1310182	Case-control association analysis of rheumatoid arthritis with candidate genes using related cases.
PTPN22	Rs3761935	Genetic risk factors for rheumatoid arthritis differ in Caucasian and Korean populations.
PTPN22	Rs3761935	PTPN22 genetic variation: evidence for multiple variants associated with rheumatoid arthritis.
PTPN22	Rs33996649	The PTPN22 R263Q polymorphism is a risk factor for rheumatoid arthritis in Caucasian case-control samples.
PTPN22	Rs1310182	Comparison of the power of haplotype-based versus single- and multilocus association methods for gene x environment (gene x sex) interactions and application to gene x smoking and gene x sex interactions in rheumatoid arthritis.
PTPN22	Rs1310182	Meta-genetic association of rheumatoid arthritis and PTPN22 using PedGenie 2.1.
PTPN22	Rs12730735	Case-control association analysis of rheumatoid arthritis with candidate genes using related cases.
PTPN22	Rs12730735	Comparison of the power of haplotype-based versus single- and multilocus association methods for gene x environment (gene x sex) interactions and application to gene x smoking and gene x sex interactions in rheumatoid arthritis.
PTPN22	Rs12730735	Modeling the effect of PTPN22 in rheumatoid arthritis.
PTPN22	Rs12730735	Meta-genetic association of rheumatoid arthritis and PTPN22 using PedGenie 2.1.
PTPN22	Rs12730735	PTPN22 genetic variation: evidence for multiple variants associated with rheumatoid arthritis.
PTPN22	Rs1310182	PTPN22 genetic variation: evidence for multiple variants associated with rheumatoid arthritis.
PTPRC	Rs17612648	No association between transmembrane protein-tyrosine phosphatase receptor type C (PTPRC) exon A 77C>G transversion and liver transplant rejection.
PTPRD	Rs1975197	Note that a nearby SNP, rs4626664, was also shown to independently confer risk for restless legs syndrome in this same study.Restless Legs Syndrome: Preliminary Research.
PTPRD	Rs4626664	Note that a nearby SNP, rs1975197, was also shown to independently confer risk for restless legs syndrome in this same study.Restless Legs Syndrome: Preliminary Research.
PTPRQ	Rs749210663	The rare (deletion) allele for this PTPRQ gene variant is reported to be causative for a recessive form of deafness; see PTPRQ for details and sources.
PTPRQ	Rs61729287	The rare (T) allele for this PTPRQ gene variant is reported to be causative for a recessive form of deafness; see PTPRQ for details and sources.
PTPRQ	Rs147541734	The rare allele for this PTPRQ gene variant is reported to be causative for a recessive form of deafness; see PTPRQ for details and sources.
PTPRQ	Rs190166486	The rare allele for this PTPRQ gene variant is reported to be causative for a recessive form of deafness; see PTPRQ for details and sources.
PYGM	Rs119103252	PYGM gene, c.1628A>C, p.Lys543Thr or K543T23andMe name: i5005800.
QDPR	Rs744731	Neurotransmission and bipolar disorder: a systematic family-based association study.
RAB27A	Rs104894497	Aka c.259G>C (p.Ala87Pro) Reported in ClinVar as potentially pathogenic for Griscelli syndrome, while a 2016 publication finds heterozygotes associated with familial hemophagocytic lymphohistiocytosis.23andMe name: i5003825.
RAB6B	Rs2280673	Relevant to Hemochromatosis.
RAD50	Rs2240032	Associations between single nucleotide polymorphisms in double-stranded DNA repair pathway genes and familial breast cancer.
RAD50	Rs2244012	Characterization of the linkage disequilibrium structure and identification of tagging-SNPs in five DNA repair genes.
RAPSN	Rs104894299	The N88K mutation is the most common one leading, when inherited recessively, to congenital myasthenic syndrome.
RAPSN	Rs45547231	rs45547231, also known as c.193-15C>A, is an intronic variant in the RAPSN gene on chromosome 11.One 2006 publication concludes based on patient and functional data that this variant is a splice mutation, which when combined with another RAPSN mutation, can lead to the recessively inherited condition known as congenital myasthenic syndrome.
RARG	Rs2229774	Genome Web news rs2229774, also known as p.Ser427Leu, in the RARG gene ups cardiotoxicity risk by roughly five times in children treated with the cancer drug anthracycline, based on a GWAS of a small number of anthracycline-treated childhood cancer patients (32 cases in the original discovery cohort and 22 in the replication population).
RB1	Rs4151620	rs2854344 has been reported previously to be associated with breast cancer risk.
RB1	Rs2854344	Showed no association with ovarian cancer risk 4,624 invasive epithelial ovarian cancer cases and 8,113 controls of white non-Hispanic origin ovarian cancer.
RB1	Rs2854344	Associated with breast cancer risk and ovarian cancer More specifically: carriers of two rs2854344 (A) alleles have a 25% reduced risk of developing ovarian cancer compared to carriers of two rs2854344 (G) alleles, in a survey of ~5,000 women from the US, UK, and Denmark.
RB1	Rs2227311	This SNP has been linked to another SNP, rs4151620 which has been linked to ovarian cancer.More specifically: rs2227311 (C) alleles were found to be perfectly correlated to rs4151620 (G) alleles, and carriers of two rs4151620 (G) alleles have a 5X reduced risk of developing ovarian cancer compared to carriers of two rs4151620 (C) alleles, in a survey of ~5,000 women from the US, UK, and Denmark.
