gene	snp	context
CHAMP1	Rs863225076	Aka c.1044delG (p.Trp348Terfs) Considered pathogenic in ClinVar; condition not specified, but based on similar mutations also in the CHAMP1 gene, likely to be a form of autosomal dominant mental retardation.
CHAMP1	Rs863225075	Aka c.1544G>A (p.Trp515Ter) Considered pathogenic in ClinVar; condition not specified, but based on similar mutations also in the CHAMP1 gene, likely to be a form of autosomal dominant mental retardation.
CHAMP1	Rs200070245	Aka c.1768C>T (p.Gln590Ter) Considered pathogenic in ClinVar for a form of autosomal dominant mental retardation.
CHAMP1	Rs797044961	Aka c.635delC (p.Pro212Leufs) Considered pathogenic in ClinVar for a form of autosomal dominant mental retardation.
CHAMP1	Rs782397980	Considered pathogenic in ClinVar for a form of autosomal dominant mental retardation.
CHAMP1	Rs1131691845	Aka c.403C>T (p.Gln135Ter) Considered pathogenic in ClinVar; condition not specified, but based on similar mutations also in the CHAMP1 gene, likely to be a form of autosomal dominant mental retardation.
CHAMP1	Rs863225074	Aka c.1969C>T (p.Gln657Ter) Considered pathogenic in ClinVar; condition not specified, but based on similar mutations also in the CHAMP1 gene, likely to be a form of autosomal dominant mental retardation.
CHCHD10	Rs730880031	rs730880031, also known as c.197G>T, p.Gly66Val and G66V, is a rare mutation in the CHCHD10 gene on chromosome 22.As an autosomal dominant, one copy of the rs730880031 (T) allele is reported to be sufficient to lead to the Jokela type of spinal muscular atrophy, which is also known as Late-onset spinal motor neuronopathy (LOSMoN).See also OMIM 615903.0003.
CHEK2	Rs28909982	rs28909982, also known as c.349A>G or p.Arg117Gly, represents a very rare mutation in the CHEK2 gene on chromosome 22.A 2016 publication study involving 42,000 breast cancer cases concluded that rs28909982 (G) carriers had an odds ratio of 2.0 (CI:1.1-3.7; p=0.003).
CHEK2	Rs1805129	This SNP represents a silent polymorphism in the cancer-associated cell cycle regulator CHEK2 gene.
CHEK2	Rs17879961	rs17879961 one of 3 SNPs associated with increased risk of lung cancer.
CHEK2	Rs17879961	This SNP, a variant in the CHEK2 gene, is 1 of 25 SNPs reported to represent independently minor, but cumulatively significant, increased risk for breast cancer.
CHEK2	I4000462	Breast Cancer rs555607708.
CHEK2	Rs17879961	For details of all 25 SNPs in this group, along with the two methods used to calculate overall risk estimates for breast cancer, refer to the SNPedia breast cancer entry.For this particular SNP, the risk (minor) allele is (C).
CHI3L1	Rs10399931	Chitinase 3-like 1 gene-329G/A polymorphism, plasma concentration and risk of coronary heart disease in a Chinese population.
CHI3L1	Rs4950928	An attempt to repeat the association between rs4950928 and risk for schizophrenia in an ethnically identical population (Japanese) as well as a new population (Han Chinese) failed to show any significant association.
CHI3L1	Rs6691378	Association of polymorphisms of the CHI3L1 gene with asthma and atopy: a populations-based study of 6514 Danish adults.
CHIT1	Rs2297950	rs2297950 is a single nucleotide polymorphism at position 102 (Gly102Arg) in the chitotriosidase gene which results in chitotriosidase deficiency, implicated in altered defense against chitin containing organisms and in some inflammatory conditions such as inflammatory bowel disease and asthma.
CHM	Rs132630267	Aka c.1497C>A (p.Cys499Ter).
CHRM2	Rs324640	SNPs in the SNAP25 gene were initially linked to intelligence but have failed to replicate.While now suspect, the original work can be found in and or this pdf poster show association between the CHRM2 gene and intelligence.
CHRM2	Rs324640	A nearby SNP, rs324650, showed similar results to rs324640, and was in linkage disequilibrium (r2 = 0.90) with it.
CHRM2	Rs8191992	Synergistic effects of genetic variation in nicotinic and muscarinic receptors on visual attention but not working memory.
CHRM3	Rs2165870	rs2165870 is a SNP in or near the promoter region of the muscarinic acetylcholine receptor 3 subtype CHRM3 gene on ch 1.A GWAS study of 300+ patients exhibiting post-operative nausea found that carriers of rs2165870 (A) alleles were at 2.3x higher risk for nausea (CI: 1.36 - 4, p = 0.002). rs2355230 is said to be a perfect proxy (r2 = 1) for rs2165870.
CHRM3	Rs7520974	Associated with specific patterns of brain activity.
CHRNA3	Rs578776	Genetic polymorphisms in 15q25 and 19q13 loci, cotinine levels, and risk of lung cancer in EPIC.
CHRNA3	Rs578776	Risk for nicotine dependence and lung cancer is conferred by mRNA expression levels and amino acid change in CHRNA5.
CHRNA3	Rs8042374	Lung cancer rs8042374 P = 7.75 x 10 (-12).
CHRNA3	Rs4887067	Plos Risk Factors for Age-Dependent Nicotine Addiction.
CHRNA3	Rs1051730	rs1051730 (T;T) individuals respond slower to alcohol, which generally is considered to actually increase their long-term risk of alcohol abuse./ 23andMe blog (T;T) makes it harder to quit smokingPeripheral Artery Disease.
CHRNA3	Rs578776	Familial aggregation of common sequence variants on 15q24-25.1 in lung cancer.
CHRNA4	Rs1044396	Subjects with the (T;T) genotype showed robust brain activity in the parietal cortex while subjects with the (C;C) genotype showed very little change in activity.
CHRNA4	Rs3787137	Genetic variability in nicotinic acetylcholine receptors and nicotine addiction: converging evidence from human and animal research.
CHRNA5	Rs684513	Multiple independent loci at chromosome 15q25.1 affect smoking quantity: a meta-analysis and comparison with lung cancer and COPD.
CHRNA5	Rs6495306	rs6495306 increases susceptibility to Substance dependence, Alcohol 1.43 times for carriers of the G allele.
CHRNA5	Rs951266	Risk for nicotine dependence and lung cancer is conferred by mRNA expression levels and amino acid change in CHRNA5.
CHRNA5	Rs17486278	Risk for nicotine dependence and lung cancer is conferred by mRNA expression levels and amino acid change in CHRNA5.
CHRNA5	Rs16969968	Associated with smoking phenotype (p=0.007) based on association study of 2,000+ individuals, and functional studies demonstrated that the risk allele decreased response to a nicotine agonist, therefore the rs16969968 (A) allele is likely to be involved in nicotine dependence.In a study 500+ individuals with cocaine dependence, the same rs16969968 (A) allele was associated with a 0.67x decreased risk (p = 0.0045).A study of 200 individuals replicated the association between this SNP and nicotine dependence, and also concluded that the rs16969968 (A) allele was significantly associated with enhanced pleasurable responses to a persons first cigarette./ 23andMe blog 23andMe considers rs1051730 equivalent The association between rs16969968 and lung cancer may, in part, be confounded by chronic obstructive pulmonary disease. rs16969968 increases susceptibility to Substance dependence, Nicotine 1.10 times for heterozygotes (AG) and 1.90 times for homozygotes (AA) plos Risk Factors for Age-Dependent Nicotine Addiction.
CHRNA5	Rs4887067	Plos Risk Factors for Age-Dependent Nicotine Addiction.
CHRNA7	Rs1355920	Associated with specific patterns of brain activity.
CHRNA7	Rs3087454	Associated with specific patterns of brain activity.
CHRNA7	Rs6494223	A significant association between delusions and the rs6494223 (T) allele (odds ratio 1.63, CI: 1.22-2.17, p = 0.014, ) was found in a cohort of Alzheimers disease patients in Northern Ireland.
CHRNB3	Rs6474413	rs6474413 increases susceptibility to Substance dependence, Nicotine 1.35 times for carriers of the T allele.
CLCN1	Rs80356690	Myotonia levior is a chloride channel disorder.
CLCN1	I5003253	Myotonia congenita rs121912810.
CLCN1	I5003259	Myotonia congenita rs80356690.
CLCN1	I5003260	Myotonia congenita rs80356696.
CLCN1	Rs121912810	rs121912810, also known as p.Ser189Phe, is a mutation in the CLCN1 gene on chromosome 7.Acting in an autosomal dominant manner, the rs121912810 (T) allele is considered to cause Thomsens myotonia congenita; see also OMIM 118425.0018Note that 23andMe refers to this SNP as i5003253.
CLCN1	Rs80356694	Decrement of compound muscle action potential is related to mutation type in myotonia congenita.
CLDN14	Rs368027306	rs368027306, also known as c.242G>A, p.Arg81His and R81H, represents a variant in the CLDN14 gene on chromosome 21.Inherited in a recessive manner, the minor allele of this SNP is considered pathogenic for a form of deafness; see OMIM and ClinVar sidebars for details.
CLDN14	Rs74315437	rs74315437, also known as c.254T>A, p.Val85Asp and V85D, represents a variant in the CLDN14 gene on chromosome 21.Inherited in a recessive manner, the minor allele of this SNP is considered pathogenic for a form of deafness; see OMIM and ClinVar sidebars for details.
CLDN14	Rs219781	Kidney Stones.
CLDN14	Rs786204841	rs786204841, also known as c.694G>A, p.Gly232Arg and G232R, represents a variant in the CLDN14 gene on chromosome 21.Inherited in a recessive manner, the minor allele of this SNP is considered pathogenic for a form of deafness; see OMIM and ClinVar sidebars for details.
CLDN14	Rs219778	DeCode reports that carriers of two T alleles at rs219778 have a slightly increased risk of developing kidney stones.
CLDN14	Rs143797113	rs143797113, also known as c.488C>T and p.Ala163Val, represents an uncommon variant in the CLDN14 gene on chromosome 21.Although initially reported in ClinVar as a variant of unknown significance, the minor rs143797113 (A) is now published as pathogenic for an early (childhood) onset form of deafness when inherited recessively, i.e.
CLDN14	Rs219780	The rs219780 (C;C) genotype is also associated with decreased bone mineral density.
CLDN16	Rs765256758	Aka NM_006580.3 (CLDN16) :c.416C>T or (p.Ala139Val) OMIM pathogenic variant.
CLEC16A	Rs17806056	778 Common variable immunodeficiency disorder (CVID) cases compared with 10,999 controls using the Illumina Immunochip; the first non-HLA genome-wide significant risk for CVID locus was found within the CLEC16A gene, namely rs17806056.
CLEC16A	Rs2041733	Multi-ancestry genome-wide association study of 21,000 cases and 95,000 controls identifies new risk loci for atopic dermatitis.
CLEC16A	Rs2903692	rs2292399 and rs2903692 both significantly associated with type 1 diabetes odds ratio 1.37 and 1.28.
CLEC16A	Rs725613	Associated with type-1 diabetesIn a separate study, Sardinians with either type-1 diabetes (1,037 patients) or multiple sclerosis (1,498 patients) plus matched controls were genotyped for rs725613.
CLEC16A	Rs725613	In this study, the rs725613 (A) allele was positively associated not only with type-1 diabetes (odds ratio 1.15, p = 5.1 x 10e-3) but also with multiple sclerosis (odds ratio = 1.21, p = 6.7 x 10e-5).
CLEC16A	Rs725613	The effect of single nucleotide polymorphisms from genome wide association studies in multiple sclerosis on gene expression.
CLN3	Rs386833721	Non-coding variant assessed as part of Blueprint Genetics Retinal dystrophy (266 gene) panel.
CLOCK	Rs1554483	A study of 391 overweight patients concluded that the haplotype of rs1554483 (G) and rs4864548 (A) was associated with a 1.8-fold higher risk (CI: 1.31-2.54, p < 0.001) of obesity.
CLOCK	Rs4864548	A study of 391 overweight patients concluded that the haplotype of rs1554483 (G) and rs4864548 (A) was associated with a 1.8-fold higher risk (CI: 1.31-2.54, p < 0.001) of obesity.
CLOCK	Rs6832769	The effect remained significant in the replicative American sample, but failed to achieve significance in the Norwegian sample and third sample (though the combined p value remained significant at 0.000865).
CLRN1	Rs1085307050	OMIM pathogenic.
CLRN1	Rs111033258	rs111033258, also known as N48K or Asn48Lys, is a SNP in the clarin 1 CLRN1 gene on chromosome 3.Most common in Ashkenazi Jews, the risk allele rs111033258 (G) leads to Usher Syndrome Type III if inherited in two copies.
CLTCL1	Rs1061325	The authors suggest that heterozygotes may have a selective advantage, with M1316 homozygotes presumably most prone to developing insulin resistance on modern diets.
CMAS	Rs2955503	Genes controlling postural changes in blood pressure: comprehensive association analysis of ATP-sensitive potassium channel genes KCNJ8 and ABCC9.
CMAS	Rs2955503	rs2955503 (A) associated with postural changes in blood pressure.
CMAS	Rs2955503	Also in haplotype rs2900492 (A) - rs2955503 (A) associated with postural changes in blood pressure.
CNGB3	Rs121918344	rs121918344, also known as S435F or SER322PHE, is a SNP in the cyclic nucleotide-gated channel beta-3 CNGB3 gene.Originally observed in Pingelapese islanders, a condition involving total colorblindness, photophobia, nystagmus, 20/200 visual acuity, yet a normal-appearing retina, was eventually found by sequence analysis to be due to a C-to-T transition causing a serine-to-phenylalanine substitution at amino acid 435 of this (CNGB3) gene.
CNGB3	Rs35365413	Cone cGMP-gated channel mutations and clinical findings in patients with achromatopsia, macular degeneration, and other hereditary cone diseases.
CNGB3	Rs3735967	Achromatopsia: the CNGB3 p.T383fsX mutation results from a founder effect and is responsible for the visual phenotype in the original report of uniparental disomy 14.
CNGB3	Rs397515360	rs397515360, also known as c.1148delC or p.Thr383IlefsX13, represents a rare mutation in the CNGB3 gene on chromosome 8.Inherited recessively, the rs397515360 (-) deletion allele is considered in ClinVar (and BabySeq) to be pathogenic for achromatopsia.23andMe name: i5012559.
CNR1	Rs2023239	rs2023239 influences cannabis dependence.
CNR1	Rs6454674	Further evidence for association of polymorphisms in the CNR1 gene with cocaine addiction: confirmation in an independent sample and meta-analysis.
CNR1	Rs806378	Randomized pharmacodynamic and pharmacogenetic trial of dronabinol effects on colon transit in irritable bowel syndrome-diarrhea.
CNR1	Rs9450898	Allele-specific differences in activity of a novel cannabinoid receptor 1 (CNR1) gene intronic enhancer in hypothalamus, dorsal root ganglia, and hippocampus.
CNTNAP2	Rs851715	Speech development rs4431523, rs17236239 and significant associations (with P values from 0.01 to 5.0x10&#8211;5) between nonsense-word repetition and nine intronic SNPs ( rs851715, rs10246256, rs2710102, rs759178, rs1922892, rs2538991, rs17236239, rs2538976, and rs2710117 ).
CNTNAP2	Rs7794745	Do candidate genes discriminate patients with an autism spectrum disorder from those with attention deficit/hyperactivity disorder and is there an effect of lifetime substance use disorders?.
CNTNAP2	Rs7794745	Related article A genome-wide association study of autism reveals a common novel risk locus at 5p14.1.
CNTNAP2	Rs7794745	A common SNP in the CNTNAP2 gene, rs7794745, is associated with increased risk for autism based on a study of 148 affected children from families with two more autistic children.
CNTNAP2	Rs4431523	News rs4431523 in CNTNAP2 were significantly associated with the inability of children with typical specific language impairment to process and repeat nonsense words NEJM Speech development rs4431523, rs17236239 and significant associations (with P values from 0.01 to 5.0x10&#8211;5) between nonsense-word repetition and nine intronic SNPs ( rs851715, rs10246256, rs2710102, rs759178, rs1922892, rs2538991, rs17236239, rs2538976, and rs2710117 ).
CNTNAP2	Rs10246256	Speech development rs4431523, rs17236239 and significant associations (with P values from 0.01 to 5.0x10&#8211;5) between nonsense-word repetition and nine intronic SNPs ( rs851715, rs10246256, rs2710102, rs759178, rs1922892, rs2538991, rs17236239, rs2538976, and rs2710117 ).
CNTNAP2	Rs2710117	Speech development rs4431523, rs17236239 and significant associations (with P values from 0.01 to 5.0x10&#8211;5) between nonsense-word repetition and nine intronic SNPs ( rs851715, rs10246256, rs2710102, rs759178, rs1922892, rs2538991, rs17236239, rs2538976, and rs2710117 ).
CNTNAP2	Rs2538991	Reported to be in very tight (r<sup>2</sup>>0.98) linkage with rs2710102, and thus potentially associated with autism.
CNTNAP2	Rs2538976	Speech development rs4431523, rs17236239 and significant associations (with P values from 0.01 to 5.0x10&#8211;5) between nonsense-word repetition and nine intronic SNPs ( rs851715, rs10246256, rs2710102, rs759178, rs1922892, rs2538991, rs17236239, rs2538976, and rs2710117 ).
CNTNAP2	Rs371642222	Aka NM_014141.5 (CNTNAP2) :c.3046C>T or (p.Arg1016Ter) OMIM pathogenic variant.
COCH	Rs1045644	Sequence variants in host cell factor C1 are associated with Menieres disease.
COCH	Rs28938175	Deafness.
COL11A1	Rs1676486	Lumbar disc herniation (LDH), a form of lumbar disc disease, is one of the most common musculoskeletal diseases.
COL11A1	Rs1676486	rs1676486, a SNP also known as c.4603C-->T in the COLL11A1 gene (one of 3 Type XI collagen genes), has been implicated in a study of ~800 Japanese patients as being associated with LDH.
COL11A1	Rs587782990	Non-coding variant assessed as part of Blueprint Genetics Retinal dystrophy (266 gene) panel.
COL1A1	Rs1107946	Bone mineral density and genetic markers involved in three connected pathways (focal adhesion, actin cytoskeleton regulation and cell cycle) : the CUMAGAS-BMD information system.
COL1A1	Rs1800215	Connective tissue and related disorders and preterm birth: clues to genes contributing to prematurity.
COL1A2	Rs42524	rs42524 is a SNP in the COL1A2 gene.This SNP has been associated with familial intracranial aneurysms (IA) in both Japanese and Chinese populations; in Chinese patients, the odds ratio is 2.579 (CI: 1.48-4.47).
COL2A1	Rs121912880	Aka c.1510G>A (p.Gly504Ser or G504S), also c.1510G>T (p.Gly504Cys or G504C). both are considered in ClinVar as dominantly inherited mutations pathogenic for Spondylometaphyseal dysplasia and/or Stickler syndrome type I.
COL3A1	Rs1057521106	Aka c.811C>T (p.Arg271Ter) Reported in ClinVar as pathogenic for vascular Ehlers-Danlos syndrome, type 4; also observed in a sudden cardiac death patient.
COL3A1	Rs1800255	No significance was found for the heterozygous genotype.A meta-analysis published in 2014 reported that the rs1800255 (A;A) genotype was associated with pelvic organ prolapse (OR 4.79; CI: 1.91-11.98, p =.001) compared with the reference genotype (G;G) in populations of Asian and Dutch women.
COL4A3	Rs121912826	Mutations in theCOL4A4 and COL4A3 genes cause familial benign hematuria.
COL4A3	Rs121912827	Mutations in theCOL4A4 and COL4A3 genes cause familial benign hematuria.
COL5A1	Rs12722	Variants within the COL5A1 gene are associated with Achilles tendinopathy in two populations.
COL5A1	Rs12722	Variants within the MMP3 gene are associated with Achilles tendinopathy: possible interaction with the COL5A1 gene.
COL5A1	Rs61735045	rs61735045, also known as c.1588G>A, p.Gly530Ser and G530S, is a variant in the COL5A1 gene on chromosome 9.Two papers published in 2000 and 2002 proposed that carrying one copy of an rs61735045 (A) allele worsened symptoms of Ehlers-Danlos syndrome (EDS) in those who had it due to a causative mutation elsewhere, and that carrying two copies would cause EDS.
COL5A1	Rs61735045	A 2009 publication found that the frequency of the 530S allele was similar (about 5%) in all groups of people they studied, whether healthy or EDS-affected.
COL5A1	Rs61735045	Furthermore, the predicted homozygote minor frequency of 1 in 400 people is much higher than that of classical EDS.
COL5A1	Rs61735045	More recently, ExAC analysis shows an allele frequency of 3.5%, and a minor homozygote frequency of about 1 in 1000, which is still an order of magnitude or more higher than the estimated EDS incidence, incidating that either this allele is benign or the penetrance of even a double mutation is quite low.Additionally, as of 2014, two labs are reporting in ClinVar this variant as benign.
COL9A3	Rs61734651	rs61734651, most commonly known as the Trp3 allele yet technically also known as c.307C>T, p.Arg103Trp and R103W, represents a variant in the COL9A3 gene on chromosome 20.Several studies, albeit older ones and relatively small ones, have linked the rs61734651 (T) allele to somewhat higher risk (odds ratio of ~3) to lumbar disc disease.
COL9A3	Rs35908728	For details, see the entry for lumbar disc disease.
COMT	Rs165599	Anxiety-related personality traits, ADHD, schizophreniapart of a three marker haplotype rs737865 - rs4680 - rs165599 epistasis between SNPs in COMT ( rs2097603, Val158Met ( rs4680 ), rs165599 ) and polymorphisms in other schizophrenia susceptibility genespopular in pubmed is associated with bipolar disorder and influences prefrontal aspects of verbal memory in bipolar patients and healthy controls.
COMT	Rs165631	rs165631, also known as p.L203, represents a synonymous variant in the COMT gene; the minor rs165631 (T) allele has a population allele frequency of 1% (based on exome sequencing of 60,000 individuals).Admittedly based on only a handful of cases, a preliminary report hunting for variants that might delay or prevent breast cancer in women carrying either disease-causing BRCA1 or BRCA2 mutations observed that the rs165631 (T) allele was present in 5 of 15 women with BRCA1/2 mutations (but not breast cancer), while it was not present in any of 25 women with breast cancer (in a different group of women).
COMT	Rs165688	(/ via g2b2mh blog) rs165688 correlated with preferences for immediate reward and brain activation.
COMT	Rs2097603	Gray matter volume and interacts with rs2097603 related to extracellular dopamine.
COMT	Rs4633	Pubmed 1180576 Schizophrenia Susceptibility Genetic basis for individual variations in pain perception and the development of a chronic pain condition.
COMT	Rs769224	Influence and interaction of genetic polymorphisms in catecholamine neurotransmitter systems and early life stress on antidepressant drug response.
COMT	Rs9332377	/ 23andMe blog hearing loss linked to a chemotherapy drug named Cisplatin.
CPED1	Rs148771817	The rs148771817 (T) allele, located within an intron of the CPED1 gene on chromosome 7, was found to be associated with an increase in bone density in both replications and meta-analyses, with an average increase of +0.46 s.d.
CPED1	Rs190543052	C7orf58 SNP; one of five used in genetic risk score for lifetime prevalence of femoral fracture in Japanese males.
CREBBP	Rs3025684	Candidate-gene screening and association analysis at the autism-susceptibility locus on chromosome 16p: evidence of association at GRIN2A and ABAT.
CREBRF	Rs373863828	Odds ratio of 1.35), and this rare variant is far more common among Samoans than Africans, Europeans or East Asians.However, since the frequency of this variant in Samoans is unlikely to have changed dramatically over the last 200 years, whereas the obesity rare in this population has increased dramatically, the variant on its own is considered insufficient to lead to obesity.
CRH	Rs28364015	/ blog an animal model suggests that the T-allele enhances the self-protection behaviors that arise from being orphaned.
CRP	Rs3093062	Functional haplotypes containing rs3091244 / rs3093062 contain rs3093061 which is associated with SLE.
CRP	Rs3093061	Genetic determinants of basal C-reactive protein expression in Filipino systemic lupus erythematosus families.
CRP	Rs3093061	rs3093061 associated with SLE and functional haplotypes containing rs3091244 / rs3093062 A study of ~1,000 patients with systemic lupus erythematosus found that in both populations (Caucasian and African-American) studied, the rs3093061 (G;G) genotype had a significantly reduced risk compared to the more common (A;A) genotype.
CRP	Rs2794521	Associated with at least one mortality outcome in a study of ~10,000 individuals.
CRP	Rs3091244	Lack of association between the genetic variations in the C-reactive protein gene and the risk of psoriasis among the Taiwanese.
CRP	Rs1800947	Although somewhat lacking in statistical power, several reports have linked rs1800947, a synonymous mutation known as CRP2 in the C-reactive protein CRP to the autoimmune disorder SLE, systemic lupus erythematosus.
CRP	Rs3093059	C-Reactive protein gene variants are associated with postoperative C-reactive protein levels after coronary artery bypass surgery.
CRYM	Rs28929490	Deafness.
CSF2RB	Rs11705394	Interaction between interleukin 3 and dystrobrevin-binding protein 1 in schizophrenia.
CSF2RB	Rs1801117	Association study of CSF2RB with schizophrenia in Irish family and case - control samples.
CSF2RB	Rs2072707	Interaction between interleukin 3 and dystrobrevin-binding protein 1 in schizophrenia.
CSF2RB	Rs2284031	Schizophrenia|.
CSNK1D	Rs104894561	rs104894561, also known as Thr4Ala or T44A, is a SNP in the casein kinase 1, delta CSNK1D gene.Heterozygotes for rs104894561 have been reported to have a sleep disorder, Familial Advanced Sleep Phase syndrome 2 (FASPS2), and it is therefore considered to be inherited as an autosomal dominant trait.
CTLA4	Rs3087243	rs2292399 and rs2903692 both significantly associated with type 1 diabetes odds ratio 1.37 and 1.28.
CTLA4	Rs4553808	This gene encodes the CD152 antigen.A study of 165 Swedish myasthenia gravis patients concluded that the rs4553808 (G;G) homozygotes had an odds ratio of 0.05 (CI: 0.00286-0.874, p=0.0023) for the disease compared to healthy individuals, while the rs4553808 (G) allele showed a less dramatic reduction in risk, with an odds ratio of 0.578 (CI: 0.373-0.897, p=0.015).
CTLA4	Rs3772534	One report based on a study of 480 Danish families indicated that the rs3772534 SNP in the CBLB gene indicated an increased risk for developing type 1 diabetes, and that there might be co-inheritance with the rs3087243 SNP found in the CTLA4 gene.
CTLA4	Rs231778	(article retracted due to artefact in genotyping).
CTLA4	Rs12992492	Comprehensive association analysis of candidate genes for generalized vitiligo supports XBP1, FOXP3, and TSLP.
CTLA4	Rs11571316	Associated with type-1 diabetes.
