gene	snp	context
AANAT	Rs3760138	Examination of association of genes in the serotonin system to autism.
ABCA1	Rs1800977	The -14C->T polymorphism rs1800977 of the ABCA1 gene was significantly associated with atherothrombotic cerebral infarction in a study of 3,400+ Japanese adults.
ABCA1	Rs1883025	Investigation of variants identified in caucasian genome-wide association studies for plasma high-density lipoprotein cholesterol and triglycerides levels in Mexican dyslipidemic study samples.
ABCA1	Rs2020927	rs2297404, rs2230808, and rs2020927 haplotype (CAC) was more prevalent in the Alzheimers disease group (0.323 in AD vs. 0.202 in control). while haplotype1 (TGG) was over-represented in the healthy controls (0.595 in control vs. 0.493 in AD) Effect of ABCA1 variant on atherogenic dyslipidaemia in patients with Type 2 diabetes treated with rosiglitazone.
ABCA1	Rs2066714	Association of genetic variants with chronic kidney disease in Japanese individuals.
ABCA1	Rs2230806	Increase in HDL-C concentration by a dietary portfolio with soy protein and soluble fiber is associated with the presence of the ABCA1R230C variant in hyperlipidemic Mexican subjects.
ABCA1	Rs2230808	A polymorphism of the ABCA1 gene confers susceptibility to schizophrenia and related brain changes.
ABCA1	Rs2297404	rs2297404, rs2230808, and rs2020927 haplotype (CAC) was more prevalent in the Alzheimers disease group (0.323 in AD vs. 0.202 in control). while haplotype1 (TGG) was over-represented in the healthy controls (0.595 in control vs. 0.493 in AD).
ABCA1	Rs4149268	G allele is associated with 0.82mg/dl increase in HDL cholesterol (good cholesterol).
ABCA12	Rs28940271	This is a recessive SNP for congenital Lamellar ichthyosis, type 2, also called ichthyosis-4A, a significant skin condition.
ABCA12	Rs28940270	This is a recessive SNP for congenital Lamellar ichthyosis, type 2, also called ichthyosis-4A, a significant skin condition.
ABCA12	Rs28940568	This is a recessive SNP for congenital Lamellar ichthyosis, type 2, also called ichthyosis-4A, a significant skin condition.
ABCA12	Rs28940268	This is a recessive SNP for congenital Lamellar ichthyosis, type 2, also called ichthyosis-4A, a significant skin condition.
ABCA12	Rs28940269	This is a recessive SNP for congenital Lamellar ichthyosis, type 2, also called ichthyosis-4A, a significant skin condition.
ABCA7	Rs113809142	rs113809142, also known as c.4416+2T>G, is one of several loss-of-function ABCA7 mutations associated with Alzheimers disease initially in Icelanders, and then replicated in other populations.Carriers of one rare rs113809142 (G) allele are at roughly more than twice the risk for developing late-onset Alzheimers disease compared to people having the most common genotype (T;T). the odds ratio is 4.47, p=3.4 × 10e−7.
ABCA7	Rs200538373	rs200538373, also known as c.5570+5G>C, is one of several loss-of-function ABCA7 mutations associated with Alzheimers disease initially in Icelanders, and then replicated in other populations.Carriers of one rare rs200538373 (C) allele are at roughly twice the risk for developing late-onset Alzheimers disease compared to people having the most common genotype (G;G). the odds ratio is 1.91, p=3.8 × 10e−6.
ABCA7	Rs3764650	Alzheimers disease associated, based on large 2011 study The minor allele of rs3764650 in ABCA7 was associated with a later age at onset and shorter disease course according to /.
ABCA7	Rs4147929	rs4147929 is a SNP in the ATP-binding cassette, sub-family A (ABC1), member 7 ABCA7 gene. rs4147929 has been reported in a large study (IGAP) to be associated with late onset Alzheimers disease.The risk allele (oriented to the dbSNP entry) is (A). the odds ratio associated with heterozygotes is 1.15 (CI 1.11-1.19),.
ABCA7	Rs72973581	A sequencing study of 332 sporadic Alzheimers disease cases identified this ABCA7 coding variant, rs72973581 (A), also known as p.G215S, as conferring a modest but statistically significant protection against the disorder (OR 0.57, CI: 0.41-0.8, p = 0.024).
ABCA7	Rs7408475	Alzheimers disease polygenic hazard score.
ABCA7	Rs78117248	Sequencing of the ABCA7 gene in a Belgian cohort of 700+ patients with Alzheimers disease led to the association of the rare rs78117248 (G) allele with increased risk (odds ratio 2.07, CI: 1.31-3.27, p=0.0016).
ABCB1	Rs3842	rs3842 (A;G) and (G;G) was associated with increased risk of developing lung cancer (odds ratio OR.
ABCB1	Rs1128503	ABCB1 (MDR1) gene polymorphisms are associated with the clinical response to paroxetine in patients with major depressive disorder.
ABCB1	Rs1128503	Association between the functional polymorphism (C3435T) of the gene encoding P-glycoprotein (ABCB1) and major depressive disorder in the Japanese population.
ABCB1	Rs2032582	There appears to be little gene dosage effect, since homozygous rs2032582 (T;T) carriers shoulder almost all the risk (odds ratio 6.75 compared to (A;A) homozygotes, CI 3.0-15.2).
ABCB1	Rs2235035	Polymorphisms in multidrug resistance 1 (MDR1) gene are associated with refractory Crohn disease and ulcerative colitis.
ABCB1	Rs3842	1.36; 95% confidence interval 95% CI, 1.06-1.76), especially in women (2.5x) rs212090 (A;T) (T;T) increased cancer susceptibility (OR, 1.37; 95% CI, 1.03-1.83).
ABCB4	Rs58238559	Aka c.523A>G (p.Thr175Ala) Based on a 2015 study of <100 patients, individuals carrying a rs58238559 (C) allele have a 3.75-fold increase in the probability of developing atrial fibrillation/flutter.
ABCB4	Rs45575636	This variant has been reported though to place a woman at between 2-fold to 16-fold higher risk for intrahepatic cholestasis of pregnancy, according to separate papers cited in OMIM 171060.0012.
ABCC2	Rs2273697	Functional studies showed that this SNP selectively reduced carbamazepine transport across the cell membrane.
ABCC2	Rs3740065	rs3740065 is a SNP in the ATP-binding cassette, sub-family C (CFTR/MRP), member 2 ABCC2 gene.A study of 282 hormone receptor-positive, invasive breast cancer Japanese patients receiving tamoxifen found a significant association with shorter recurrence-free survival (p =.00017; hazard ratio 10.64, CI: 1.44 - 78.88) in rs3740065 (T;T) patients; the hazard ratio for carriers of one (T) allele was 3.5 (CI: 0.5-26).
ABCC2	Rs717620	Polymorphisms of MRP2 (ABCC2) are associated with susceptibility to nonalcoholic fatty liver disease.
ABCC4	Rs11568658	Analysis of 17,576 potentially functional SNPs in three case-control studies of myocardial infarction.
ABCC4	Rs9561778	The ADRs for these patients tended to be gastrointestinal toxicity and leukopenia/neutropenia.
ABCC6	Rs212077	A systems genetics approach implicates USF1, FADS3, and other causal candidate genes for familial combined hyperlipidemia.
ABCC6	Rs63749796	Novel ABCC6 mutations in pseudoxanthoma elasticum.
ABCC6	Rs63749823	A spectrum of ABCC6 mutations is responsible for pseudoxanthoma elasticum.
ABCC8	Rs151344624	The risk of focal CHI is 1 in 540 per pregnancy in offspring of carrier fathers because there can be somatic loss of heterozygosity causing the focal form of the disease.
ABCC8	Rs1048095	rs1048095, also known as L225P, Leu225Pro and 674T>C, is a rare variant in the ATP-binding cassette, sub-family C (CFTR/MRP), member 8 ABCC8 gene.Heterozygous carriers for this SNP are reported to have permanent neonatal diabetes mellitus (PNDM).
ABCC8	Rs151344623	The risk of focal CHI is 1 in 540 per pregnancy in offspring of carrier fathers because there can be somatic loss of heterozygosity causing the focal form of the disease.
ABCC8	I5012556	Familial Hyperinsulinism (ABCC8-related) /.
ABCC8	I5008233	Familial Hyperinsulinism (ABCC8-related) /.
ABCC8	I5012558	Familial Hyperinsulinism (ABCC8-related) /.
ABCC9	Rs11046232	In haplotype rs2900492 (G) - rs11046232 (A) - rs4148649 (A) - rs4762865 (A) associated with postural changes in blood pressure.
ABCC9	Rs2900492	rs2900492 (G) associated with postural changes in blood pressure.
ABCC9	Rs2900492	Also in haplotypes rs2900492 (A) - rs2955503 (A) and rs2900492 (G) - rs11046232 (A) - rs4148649 (A) - rs4762865 (A) associated with postural changes in blood pressure.
ABCC9	Rs2955503	Genes controlling postural changes in blood pressure: comprehensive association analysis of ATP-sensitive potassium channel genes KCNJ8 and ABCC9.
ABCC9	Rs2955503	rs2955503 (A) associated with postural changes in blood pressure.
ABCC9	Rs2955503	Also in haplotype rs2900492 (A) - rs2955503 (A) associated with postural changes in blood pressure.
ABCC9	Rs4148649	In haplotype rs2900492 (G) - rs11046232 (A) - rs4148649 (A) - rs4762865 (A) associated with postural changes in blood pressure.
ABCC9	Rs4762865	In haplotype rs2900492 (G) - rs11046232 (A) - rs4148649 (A) - rs4762865 (A) associated with postural changes in blood pressure.
ABCD1	Rs398123104	Aka c.1660C>A (p.Arg554Ser) Reported in ClinVar as pathogenic for adrenoleukodystrophy (ALD). however, this variant is not listed in the ALD Mutation Database.
ABCD1	Rs1057518721	Aka c.107C>A (p.Ser36Ter) Reported in ClinVar as associated with Chromosome Xq28 deletion syndrome; hemizygous mutation in the BCAP31 gene can lead to deafness, dystonia, and cerebral hypomyelination (DDCH).
ABCD1	Rs1131691743	Aka c.761C>T (p.Thr254Met) and c.761C>A (p.Thr254Lys), both of which are pathogenic for adrenoleukodystrophy according to the ALD Mutation Database.
ABCD1	Rs398123109	Aka c.31_46del16 (p.Arg11Serfs) Reported in ClinVar as pathogenic for adrenoleukodystrophy (ALD).
ABCG2	Rs3114018	rs3114018 (C), a variant in the ABCG2 gene, was the most significantly associated with gout in a 2017 study of ~200 Han Chinese patients (OR 3.19, CI:2.24–4.55, p=6.1x10e-11).
ABCG2	Rs3114018	This study also defined 5 haplotype blocks associated with gout.
ABCG2	Rs2231142	Among non-small cell lung cancer patients treated with gefitinib, theres a 4-5x higher risk of diarrhea for rs2231142 heterozygotes (and presumably minor allele homozygotes), based on a study of 124 patients treated with 250mg oral gefitinib once daily. rs2231142 also appears to influence the effectiveness of rosuvastatin.
ABCG2	Rs2231137	The risk of ischemic stroke was higher in Val allele homozygotes than in Met allele carriers.
ABCG2	Rs2231137	The (G) allele encodes the Val.In a study of incident ischemic stroke during 14 years of follow-up in a population-based study of older adults known as the Cardiovascular Health Study (CHS), rs2231137 was associated with stroke in both white (hazard ratio, 1.46, CI: 1.05 - 2.03) and black (hazard ratio, 3.59, CI, 1.11 - 11.6) participants.
ABCG2	Rs1481012	A gene-wide investigation on polymorphisms in the ABCG2/BRCP transporter and susceptibility to colorectal cancer.
ABCG8	Rs11887534	Up to 10% of the population attributable risk for gallstones may be accounted for by this SNP.
ABCG8	Rs41360247	rs41360247 increases susceptibility to Gallstone disease 2.30 times for carriers of the C allele.
ABCG8	Rs6756629	DeCode reports that the G allele is associated with a lower risk of gallstone disease (cholelithiasis).
ABO	Rs8176749	This SNP is in the ABO gene, and is therefore potentially useful in determing ABO blood group, such as through the use of genosets.
ABO	Rs8176747	This SNP is in the ABO gene, and is therefore potentially useful in determing blood group type, such as through the use of genosets.ABO Blood Type.
ABO	Rs8176746	This SNP is a variant in the ABO gene, and is therefore potentially useful in determining ABO blood group, such as through the use of genosets.23andMe reports this as a G/T while decodeme reports it as an A/C.
ABO	Rs8176743	This SNP is in the ABO gene, and is therefore potentially useful in determing blood group type, such as through the use of genosets.ABO Blood Type.
ABO	Rs8176741	This SNP is in the ABO gene, and is therefore potentially useful in determing blood group type, such as through the use of genosets.
ABO	Rs8176740	Influences ABO blood groupABO Blood Type.
ABO	Rs8176719	A person who is rs8176719 (G;G) is likely to be of blood type A, B, or AB, but due to the existence of (rare) nonfunctional O alleles brought about by (nondeletional) mutations at other positions than rs8176719, they could at least theoretically still be phenotyped as type O.The determination of blood group types A, B, and AB through SNP analysis is reflected in the appropriate genosets.
ABO	Rs8176694	This SNP is a variant in the ABO gene, and is therefore potentially useful in determining ABO blood group, such as through the use of genosets.
ABO	Rs7853989	This SNP is in the ABO gene, and is therefore potentially useful in determing blood group type, such as through the use of genosets.ABO Blood Type.
ABO	Rs657152	Genetic variants associated with Von Willebrand factor levels in healthy men and women identified using the HumanCVD BeadChip.
ABO	Rs574347	This SNP is a variant in the ABO gene, and is therefore potentially useful in determining ABO blood group, such as through the use of genosets.
ABO	Rs8176750	This particular SNP can be useful in determining whether an ABO type A allele is more specifically an A1 type allele or an A2 type allele.The more common allele (80% of A types on average) is A1, consistent with having a rs8176750 (C) allele, with the rarer A2 allele encoded by the deletion form rs8176750 (-).
ABO	Rs512770	This SNP is a variant in the ABO gene, and is therefore potentially useful in determining ABO blood group, such as through the use of genosets.
ABO	Rs56392308	rs56392308 is a SNP for the A2 ABO blood group according to the List of targets and recommended controls for prediction of certain RBC antigens in the Consortium for Blood Group Genes (CBGG) : 2009 report.The A2 allele (a minor subtype of A) is associated with rs56392308 (-), the deletion allele.
ABO	I4000504	Influences ABO blood groupABO Blood Type.
ABO	I4000505	Influences ABO blood groupABO Blood Type.
ABO	Rs1053878	Influences ABO blood group; cis-AB phenotype is associated with rs1053878 (T) ABO Blood Type.
ABO	Rs2073824	This SNP is in the ABO gene, and is therefore potentially useful in determing ABO blood group, such as through the use of genosets.
ABO	Rs1008708453	The rs1008708453 (A) allele, as represented in dbSNP (and SNPedia) on the forward/plus strand, is reported to be completely correlated to a subtype of O type alleles known as the O2 group.
ABO	Rs41302905	May influence ABO blood group see gs129ABO Blood Type.
ABO	Rs500498	This SNP is a variant in the ABO gene, and is therefore potentially useful in determining ABO blood group, such as through the use of genosets.
ABO	Rs505922	/ 23andMe blog each copy rs505922 (C) is associated with 1.2x risk of pancreatic cancerinfluences ABO blood group.
ABO	Rs507666	The novel association at the ABO locus provides evidence for a previously unknown regulatory role of histo-blood group antigens in inflammatory adhesion processes.
ABO	Rs2073828	This SNP is a variant in the ABO gene, and is therefore potentially useful in determining ABO blood group, such as through the use of genosets.
ABP1	Rs2268999	Found reduced DAO activity for the minor allele and lower DAO mRNA expression for the homozygous minor allele.
ABP1	Rs10156191	A study of 400 patients showing hypersensitivity to non-steroidal anti-inflammatory drugs (NSAIDs) found an association with the 16M allele (OR 1.7, CI: 1.3 - 2.1, Pc = 0.0003) with a gene-dose effect (P = 0.0001).
ABP1	Rs1049742	Association of single nucleotide polymorphisms in the diamine oxidase gene with diamine oxidase serum activities.
ABP1	Rs2052129	However, the same study describing the decreased gene activity reported that this variant was not associated with histamine intolerance (HIT), suggesting that the variant may be necessary but not sufficient (on its own) to lead to actual HIT.No association between the promoter SNP rs2052129 and the risk of developing NSAID hypersensitivity was seen in a 2012 study of 442 Caucasian patients.A different 2012 study of ~300 patients with selective NSAID hypersensitivity found no association for rs2052129. however, they reported that logistic regression analyses suggested that rs2052129 (C;C) homozygotes were related to selective hypersensitivity to ibuprofen.
ACADM	Rs121434280	Aka c.199T>C, p.Tyr67His), Y67H (and in older literature, Y42H or Tyr42His) According to a paper cited in OMIM, the Y42H mutation is relatively mild as ACADM mutations go, and may be a temperature-sensitive mutation, which its most deleterious effects only at increased temperatures.
ACADM	Rs200724875	Aka c.617G>A (p.Arg206His) 23andMe name: i5012761.
ACADM	I5003116	Medium-Chain Acyl-CoA Dehydrogenase Deficiency rs121434282.
ACADM	I5003117	Medium-Chain Acyl-CoA Dehydrogenase Deficiency rs121434281.
ACADVL	Rs113994167	Aka c.848T>C (p.Val283Ala or V283A) See ACADVL; this variant is considered one of the most prevalent mutations associated with VLCAD deficiency.
ACADVL	Rs140629318	Aka c.637G>A (p.Ala213Thr or A213T) as well as c.637G>C (p.Ala213Pro A213P) While consensus in ClinVar and other databases leans toward both being pathogenic very long chain acyl-CoA dehydrogenase deficiency mutations, there is some uncertainty over this, and some submitters prefer to consider both as variants of uncertain significance.
ACAT1	Rs3741049	Yasko Methylation|Yasko believes it will cause an increase in gut bugs (particularly clostridia) as well as elevated fatty acid metabolites.This is one of the SNPs reported by NutraHacker SNPs|NutraHacker.
ACAT1	Rs779565865	Aka NM_000019.3 (ACAT1) :c.149delC or (p.Thr50Asnfs) OMIM pathogenic variant.
ACE	Rs4359	This SNP in the ACE gene, also known as C17888T, is reported to influence how quickly African Americans respond to the anti-hypertensive drug ramipril.
ACE	Rs4343	More specifically: the rs4343 (A) allele is associated with the ACE-I (insertion) allele, and the rs4343 (G) allele is associated with the ACE-D allele.Another SNP in linkage disequilibrium with the ACE I/D polymorphism is rs4341., A haplotype of rs4311, rs4343, rs699 increases risk of diabetic nephropathy 4x.
ACE	Rs4353	An association analysis of Alzheimer disease candidate genes detects an ancestral risk haplotype clade in ACE and putative multilocus association between ACE, A2M, and LRRTM3.
ACE	Rs4293	This SNP in the antiotensin I converting enzyme (ACE) gene may be associated with a higher risk of Alzheimers disease.
ACE	Rs12449782	The G allele is associated with a slightly increased risk of diabetic nephropathy.
ACE	Rs4311	The risk allele T may be associated with about 1.2x increased risk of diabetic nephropathy.
ACKR1	Rs12075	This SNP encodes the major co-dominant alleles of the Duffy blood group antigen system (Fy).The rs12075 (G) allele encodes Gly42, which is the Fy (a) antigen.
ACKR1	Rs2814778	Additionally the Namibian San samples of the CEPH-HGDP are, uncharacteristically for Africans, all AA homozygotes for this SNP.The rs2814778 (G) allele is associated with African populations, while rs2814778 (A) is associated with European populations and southwestern Native American populations.
ACTA2	Rs121434528	Strokes or ministrokes (transient ischemic attacks) are often the first symptoms of the condition.
ACTA2	Rs1926203	Genome-wide significant association between a sequence variant at 15q15.2 and lung cancer risk.
ACTC1	Rs193922680	rs193922680, also known as c.301G>A, p.Glu101Lys and E101K, is a rare mutation in the ACTC1 gene on chromosome 15.Inherited as an autosomal dominant, it reportedly leads to a form of left ventricular noncompaction.The rare minor allele of this variant is reported to be pathogenic/likely pathogenic for familial hypertrophic cardiomyopathy (HCM), according to.See OMIM 102540.0009.
ACTG1	Rs28999111	Deafness.
ACTG1	Rs28999112	Deafness.
ACTN1	Rs117672662	Said to be an Amerindian-specific variant in. specifically, the allele frequency for the minor (C) allele is around 7% in many South American populations but is either undetected or under 1% in Asian, European and African populations.
ACTN3	Rs1815739	ACTN3 genotype, athletic status, and life course physical capability: meta-analysis of the published literature and findings from nine studies.
ACTN4	Rs121908416	Focal segmental glomerulosclerosisCalled i5900586 by 23andMe.
ACTN4	Rs121908417	Focal segmental glomerulosclerosisCalled i5900587 by 23andMe.
ACTN4	Rs121908415	Focal segmental glomerulosclerosisCalled i5900585 by 23andMe.
ADA	Rs121908735	Identification of two new missense mutations (R156C and S291L) in two ADA- SCID patients unusual for response to therapy with partial exchange transfusions.
ADA	Rs121908736	Hot spot mutations in adenosine deaminase deficiency.
ADA	Rs121908738	Hot spot mutations in adenosine deaminase deficiency.
ADA	Rs121908739	Hot spot mutations in adenosine deaminase deficiency.
ADAM10	I6006817	rs145518263 Alzheimers disease assocation.
ADAM10	I6006818	rs61751103 Alzheimers disease assocation.
ADAM10	Rs145518263	The rs145518263 (C) allele was found in 11 of 16 individuals affected by Alzheimers disease (average onset age 69.5 years) from seven late-onset AD families.
ADAM10	Rs61751103	The rs61751103 (G) allele was found in 11 of 16 individuals affected by Alzheimers disease (average onset age 69.5 years) from seven late-onset AD families.
ADAM19	Rs1422795	Individual and cumulative effects of GWAS susceptibility loci in lung cancer: associations after sub-phenotyping for COPD.
ADAM33	Rs628977	ADAM33 genetic polymorphisms, smoking, and rhinoconjunctivitis in Japanese women: the Kyushu Okinawa Maternal and Child Health Study.
ADAM33	Rs612709	ADAM33 genetic polymorphisms, smoking, and rhinoconjunctivitis in Japanese women: the Kyushu Okinawa Maternal and Child Health Study.
ADAM33	Rs574174	ADAM33, a new candidate for psoriasis susceptibility.
ADAM33	Rs44707	rs44707, a SNP in the ADAM33 gene, has been linked to a predisposition to asthma and bronchial hyperresponsiveness.
ADAM33	Rs512625	rs512625 was associated with psoriasis in a study of 150 French adults.
ADAM33	Rs2853209	rs2853209 (A;A) associated with atopic dermatitis in Japanese children.
ADAM33	Rs2787094	ADAM33 genetic polymorphisms, smoking, and rhinoconjunctivitis in Japanese women: the Kyushu Okinawa Maternal and Child Health Study.
ADAM33	Rs2280089	rs2280089, a SNP in the ADAM33 gene, has been linked to a predisposition to asthma and bronchial hyperresponsiveness.
ADAM33	Rs3918396	Those homozygous for the most common allele, were more likely (p< 0.0026, after Bonferroni correction) to develop chronic obstructive pulmonary disease (COPD) than carriers of one or two rs3918396 (A) alleles.
ADAMTS13	Rs28647808	rs28647808 (G) carriers) left untreated had about a 50% higher risk for renal complications (i.e.
ADCY2	Rs13166360	== Clinical Background ==Bipolar Disorder (BD) is a severe mood disorder that is characterized by recurrent episodes of depression and mania.
ADCY2	Rs13166360	Bipolar Disorders are amongst the 10 highest burden diseases, as ranked by the World Health Organization.
ADCY2	Rs13166360	For further information about bipolar disorder, wikipedia offers a great article:.== SNP Data ==A GWAS by Muhleisen and coworkers links  rs13166360  to Bipolar Disorder.
ADCY2	Rs13166360	Neither had previously been described in the context of Bipolar Disorder, and ADCY2 SNPs had not previously been associated with BD.
ADCY2	Rs13166360	rs13166360 describes a deviation from the major allele G to T (minor allele) that encodes a Valine to Leucine missense codon in ADCY2.== Relation to Disease ==There is consensus amongst the scientific and medical community that Bipolar Disorder is a multifactorial disease, with both genetic and environmental causes.
ADCY3	Rs541941351	It has been reported as potentially causing obesity when inherited recessively, but heterozygotes may be affected to a lesser degree, if this variant is driving related GWAS findings.Be aware of orientation & ambiguous flip issues due to the A/T nature of this variant and the reverse orientation of the gene.
ADCY5	Rs796065306	See the discussion at ADCY5.Considered definitely pathogenic in the Movement Disorder Society Genetic mutation database (MDSGene) for autosomal dominant familial dyskinesia, with facial myokymia.See also OMIM 600293.0001.
ADCY5	Rs11708067	Genetic variation in GIPR influences the glucose and insulin responses to an oral glucose challenge.
ADH1B	Rs6413413	On its own, this SNP is said to explain 2.5% of the variability in the rate at which alcohol is metabolized, based on a study of 250 Spaniards.More significantly (in a statistical sense), this study concluded that combinations of this SNP and others were shown to affect alcohol metabolism; most of these combinations are represented by the gs211genoset.Note that the effects of alcohol are higher in individuals who break down (basically, detoxify) ethanol more slowly.
ADH1C	Rs28730619	Genetic variation in GSNOR and childhood asthma.
ADH1C	Rs698	On its own, this SNP is said to explain 12.3% of the variability in the rate at which alcohol is metabolized, based on a study of 250 Spaniards.More significantly (in a statistical sense), this study concluded that combinations of this SNP and others were shown to affect alcohol metabolism; most of these combinations are represented by the gs211genoset.Note that the effects of alcohol are higher in individuals who break down (basically, detoxify) ethanol more slowly.
ADH1C	Rs283411	ADH single nucleotide polymorphism associations with alcohol metabolism in vivo.
