gene	snp	context
IFNL4	Rs12979860	Vitamin D binding protein gene polymorphisms and baseline vitamin D levels as predictors of antiviral response in chronic hepatitis C. Comparison of three different methods for the evaluation of IL28 and ITPA polymorphisms in patients infected with HCV.
IFNL4	Rs12979860	Early viral load and recipient interleukin-28B rs12979860 genotype are predictors of the progression of hepatitis C after liver transplantation.
IFNL4	Rs12979860	A single IL28B genotype SNP rs12979860 determination predicts treatment response in patients with chronic hepatitis C Genotype 1 virus.
IFNL4	Rs12979860	Interleukin-28B polymorphism improves viral kinetics and is the strongest pretreatment predictor of sustained virologic response in genotype 1 hepatitis C virus.
IFNL4	Rs12979860	IL28B rs12979860 C/T polymorphism in elderly chronic hepatitis C patients treated with pegylated-interferon and ribavirin.
IFNL4	Rs12979860	Several studies now indicate that this SNP predicts hepatitis C treatment-induced viral clearance.
IFNL4	Rs12979860	These studies indicate that the virus was eradicated in ~80% of (C;C) patients, compared to only about 25% of those with (T;T), while (C;T) response was intermediate.PMID 19684573, PMID 19749758, PMID 19749757FDA PGx mentions about rs12979860 with respect to Boceprevir, Simeprevir, Sofosbuvir, and Telaprevir/ 23andMe blog rs8099917 (C) less likely to respond to Hepatitis C treatment.A functional SNP rs368234815 (TT) corresponds to the rs12979860 (C). rs12979860 (C;C) better able to become naturally Hepatitis C virus-free. rs12980275 (A) usually corresponds to the rs12979860 (C) Genetic variation in IL28B and spontaneous clearance of hepatitis C virus.
IFNL4	Rs12979860	An IL28B polymorphism determines treatment response of hepatitis C virus genotype 2 or 3 patients who do not achieve a rapid virologic response.
IFNL4	Rs12979860	Impact of IL28B genotype on the early and sustained virologic response in treatment-naive patients with chronic hepatitis C. Prediction of response to pegylated interferon plus ribavirin by IL28B gene variation in patients coinfected with HIV and hepatitis C virus.
IFNL4	Rs12979860	IL28B polymorphisms and chronic hepatitis C. IL28B genotype is associated with differential expression of intrahepatic interferon-stimulated genes in patients with chronic hepatitis C. IL28B polymorphism does not determine outcomes of hepatitis B virus or HIV infection.
IFNL4	Rs12979860	The IL-28 genotype: how it will affect the care of patients with hepatitis C virus infection.
IFNL4	Rs12979860	Importance of IL28B gene polymorphisms in hepatitis C virus genotype 2 and 3 infected patients.
IFNL4	Rs12979860	Predictive value of the IL28B polymorphism on the effect of interferon therapy in chronic hepatitis C patients with genotypes 2a and 2b.
IFNL4	Rs12979860	Early virologic response and IL28B polymorphisms in patients with chronic hepatitis C genotype 3 treated with peginterferon alfa-2a and ribavirin.
IFNL4	Rs12979860	Interferon-lambda serum levels in hepatitis C. IL-28B rs12979860 C/T allele distribution in patients with liver cirrhosis: role in the course of chronic viral hepatitis and the development of HCC.
IFNL4	Rs12979860	IL28B genotype effects during early treatment with peginterferon and ribavirin in difficult-to-treat hepatitis C virus infection.
IFNL4	Rs12979860	IL-28B predicts response to chronic hepatitis C therapy--fine-mapping and replication study in Asian populations.
IFNL4	Rs12979860	Quantitation of pretreatment serum interferon-gamma-inducible protein-10 improves the predictive value of an IL28B gene polymorphism for hepatitis C treatment response.
IFNL4	Rs12979860	Impact of donor and recipient IL28B rs12979860 genotypes on hepatitis C virus liver graft reinfection.
IFNL4	Rs12979860	Peginterferon and ribavirin treatment for hepatitis C virus infection.
IFNL4	Rs12979860	Genetic variation in the interleukin-28B gene is not associated with fibrosis progression in patients with chronic hepatitis C and known date of infection.
IFNL4	Rs12979860	Beneficial IL28B genotype associated with lower frequency of hepatic steatosis in patients with chronic hepatitis C. The predictive value of IL28B gene polymorphism for spontaneous clearance in a single source outbreak cohort is limited in patients carrying the CCR5Delta32 mutation.
IFNL4	Rs12979860	Interleukin-28B polymorphisms are associated with histological recurrence and treatment response following liver transplantation in patients with hepatitis C virus infection.
IFNL4	Rs12979860	Interleukin-28B genotyping by melt-mismatch amplification mutation assay PCR analysis using single nucleotide polymorphisms rs12979860 and rs8099917, a useful tool for prediction of therapy response in hepatitis C patients.
IFNL4	Rs12979860	Influence of interleukin-28B single-nucleotide polymorphisms on progression to liver cirrhosis in human immunodeficiency virus-hepatitis C virus-coinfected patients receiving antiretroviral therapy.
IFNL4	Rs12979860	IL28B polymorphisms determine early viral kinetics and treatment outcome in patients receiving peginterferon/ribavirin for chronic hepatitis C genotype 1.
IFNL4	Rs12979860	Impact of patatin-like phospholipase-3 ( rs738409 C>G) polymorphism on fibrosis progression and steatosis in chronic hepatitis C. Real-time polymerase chain reaction assay based on high-resolution melting analysis for the determination of the rs12979860 polymorphism involved in hepatitis C treatment response.
IFNL4	Rs12979860	Portal pressure predicts outcome and safety of antiviral therapy in cirrhotic patients with hepatitis C virus infection.
IFNL4	Rs12979860	Coffee consumption is associated with response to peginterferon and ribavirin therapy in patients with chronic hepatitis C. Association between IL28B gene polymorphisms and plasma HCV-RNA levels in HIV/HCV-co-infected patients.
IFNL4	Rs12979860	Different distributions of hepatitis C virus genotypes among HIV-infected patients with acute and chronic hepatitis C according to interleukin-28B genotype.
IFNL4	Rs12979860	IL28B polymorphisms predict reduction of HCV RNA from the first day of therapy in chronic hepatitis C. IL28B genetic variation and treatment response in patients with hepatitis C virus genotype 3 infection.
IFNL4	Rs12979860	Low-density lipoprotein receptor genotyping enhances the predictive value of IL28B genotype in HIV/hepatitis C virus-coinfected patients.
IGF1	Rs12423791	Genetic polymorphisms in CYP17, CYP3A4, CYP19A1, SRD5A2, IGF-1, and IGFBP-3 and prostate cancer risk in African-American men: the Flint Mens Health Study.
IGF1	Rs2195239	Genetic variation and circulating levels of IGF-I and IGFBP-3 in relation to risk of proliferative benign breast disease.
IGF1	Rs6220	Pharmacogenetic angiogenesis profiling for first-line Bevacizumab plus oxaliplatin-based chemotherapy in patients with metastatic colorectal cancer.
IGF1R	Rs34516635	Higher IGF1 levels and an average decrease in maximal lifetime appearance|height of 2.5cm were also reported to be associated with (female Ashkenazi) centenarians.
IGF2BP2	Rs11705701	Type-2 diabetes, insulin sensitivity, and obesity with body fat decreasing ~1.5-2% per copy of the A allele.
IKBKAP	Rs111033171	Be aware of strand flipping issues in how this SNP is reported.
IKBKAP	I4000400	Familial Dysautonomia rs137853022.
IL10	Rs1518111	Association study of IL10 and IL23R-IL12RB2 in Iranian patients with Behcets disease.
IL10	Rs1554286	Genome-wide association studies identify IL23R-IL12RB2 and IL10 as Behcets disease susceptibility loci.
IL10	Rs1554286	Association study of IL10 and IL23R-IL12RB2 in Iranian patients with Behcets disease.
IL10	Rs1800871	Association of the interleukin-10 1082G/A, 819C/T and 3575T/A gene polymorphisms with systemic sclerosis: a meta-analysis.
IL10	Rs1800896	Homozygosity for the minor allele of each of the 3 SNPs was associated with increased risk of occurrence ( approximately 3-fold to 39-fold increase).A study of 258 prostate cancer cases concluded that the rs1800896 (A) allele, known to result in lower levels of this anti-inflammatory cytokine, was positively associated with risk (AG vs. GG, odds ratio of 1.69, CI: 1.10-2.60; AA vs. GG, OR of 1.81, CI: 1.11-2.96).
IL10	Rs3024490	This combination of risk alleles led to lower IL-10 expression and higher TNF gene expression, resulting in a pro-inflammatory response.
IL10	Rs3024490	The authors explain that in Ghana, pro-inflammatory alleles rescue their carriers of excess mortality in adverse environmental conditions such as drinking from boreholes, and thus minor alleles occur more frequently in African populations, but in an affluent environment, the same pro-inflammatory response leads to increased mortality, and minor alleles occur much less frequently (i.e.
IL10	Rs3024492	Dust mite exposure modifies the effect of functional IL10 polymorphisms on allergy and asthma exacerbations.Dust mite exposure significantly modified the relation between 3 SNPs in IL10 ( rs1800896, rs3024492, and rs3024496 ).
IL10	Rs3024496	Dust mite exposure modifies the effect of functional IL10 polymorphisms on allergy and asthma exacerbations.Dust mite exposure significantly modified the relation between 3 SNPs in IL10 ( rs1800896, rs3024492, and rs3024496 ).
IL12B	Rs2288831	Interleukin 12B (IL12B) genetic variation and pulmonary tuberculosis: a study of cohorts from The Gambia, Guinea-Bissau, United States and Argentina.
IL12B	Rs3212227	rs568408 GA/AA and rs3212227 AC/CC variant genotypes were associated with a significantly increased risk of cervical cancer adjusted odds ratio, 1.43; 95% confidence interval (CI), 1.06-1.93; and adjusted odds ratio, 1.30; 95% CI, 0.97-1.75, respectively.
IL12B	Rs3212227	Subjects carrying variant genotypes of both loci had a 1.82-fold (95% CI, 1.28-2.57) increased risk of cervical cancer.
IL12RB2	Rs3790568	rs3790568 susceptibility to radiation dermatitis.
IL12RB2	Rs3790565	C allele associated with increased risk of Primary biliary cirrhosis.
IL13	Rs20541	rs2569190 (T;T) and rs2569191 (C;C) genotypes associated with lower IgE/ 23andMe blog psoriasis Europeans rs20541 (G) 1.27x risk.
IL16	Rs4778889	IL-16 rs11556218 gene polymorphism is associated with coronary artery disease in the Chinese Han population.
IL17A	Rs2275913	rs2275913, also known as G-197A, is a SNP in the IL17A gene.A study of 811 Japanese subjects (524 without gastric cancer and 287 with gastric cancer) reported an odds ratio of 1.42 (CI: 1.09-1.85, p=0.01) for the rs2275913 (A) allele, and 3.02 (CI: 1.86-4.91, p<0.0001) for the (A;A) genotype, with gastric cancer.This A-allele of this SNP is also functionally associated with acute Graft-Versus-Host Disease after unrelated bone marrow transplantation.
IL18	Rs187238	Interleukin-18 promoter polymorphisms and risk of idiopathic recurrent pregnancy loss in a Tunisian population.
IL18	Rs1946518	rs1946518 and rs1946519 may influence cervical cancer.
IL18	Rs1946519	rs1946518 and rs1946519 may influence cervical cancer.
IL18	Rs3882891	Genetic variation within IL18 is associated with insulin levels, insulin resistance and postprandial measures.
IL18RAP	Rs11465702	Associations with schizophrenia and herpes rs11465702 with schizophrenia (P = 0.005). rs11465702 was also associated with herpes simplex virus 1 (HSV1) seropositivity in cases (0.006).
IL18RAP	Rs2272127	Associations with schizophrenia and herpes rs2272127 with schizophrenia (P = 0.0007, odds ratio for C allele 1.49, 95% CI: 1.18-1.87; P = 0.03 following correction for multiple comparisons). rs2272127 was also associated with herpes simplex virus 1 (HSV1) seropositivity in cases (P = 0.04, OR for G allele 1.58, 95% CI: 1.04-2.39).
IL19	Rs2243191	Evaluation of IL10, IL19 and IL20 gene polymorphisms and chronic hepatitis B infection outcome.
IL1B	Rs3087258	Epistasis between IL1A, IL1B, TNF, HTR2A, 5-HTTLPR and TPH2 variations does not impact alcohol dependence disorder features.
IL1B	Rs1143634	This association was even more pronounced in patients with higher levels of obesity or inflammatory markers. rs1143634 increases susceptibility to Alopecia Areata 2.67 times for heterozygotes (CT) and 1.13 times for homozygotes (TT) rs1143634 increases susceptibility to Alzheimers disease 2.33 times for homozygotes (TT) rs1143634 increases susceptibility to Cervical lesions, low-grade squamous intraepithelial lesions 4.29 times for heterozygotes (CT) and 3.57 times for homozygotes (TT) rs1143634 increases susceptibility to Duodenal ulcer 1.14 times for carriers of the T allele rs1143634 increases susceptibility to Inflammatory bowel disease 7.32 times for carriers of the T allele rs1143634 increases susceptibility to Joint destruction in Rheumatoid Arthritis 1.70 times for carriers of the T allele rs1143634 increases susceptibility to Myasthenia gravis 1.29 times for heterozygotes (CT) and 4.63 times for homozygotes (TT) rs1143634 increases susceptibility to Nephropathy in Type I Diabetes 2.03 times for heterozygotes (CT) and 5.01 times for homozygotes (TT) rs1143634 increases susceptibility to Peptic ulcer disease 1.06 times for carriers of the T allele rs1143634 increases susceptibility to Periodontitis 2.85 times for heterozygotes (CT) and 4.89 times for homozygotes (TT) rs1143634 increases susceptibility to Periodontitis 3.33 times for carriers of the T allele rs1143634 increases susceptibility to Survival in pancreatic cancer for carriers of the T allele rs1143634 increases susceptibility to Ulcerative colitis 1.89 times for heterozygotes (CT) and 1.59 times for homozygotes (TT).
IL1B	Rs16944	Additionally, this genotype is associated with impaired ability to achieve remission in a study of 256 Caucasian individuals with depression (odds ratio = 1.74; 95% confidence interval 1.2-4.3).The rs16944 A allele increases susceptibility to Osteoarthritis, with 1.80 times for heterozygotes (AG) and 2.90 times for homozygotes (AA) Gray matter deficits in bipolar disorder rs16944 (T;T).
IL1B	Rs1143623	Variation in human genetic polymorphisms, their association with Helicobacter pylori acquisition and gastric cancer in a multi-ethnic country.
IL1B	Rs1143627	Interaction between functional polymorphic variants in cytokine genes, established risk factors and susceptibility to basal cell carcinoma of skin.
IL1RL1	Rs11685480	Interleukin-1 receptor-like 1 polymorphisms are associated with serum IL1RL1-a, eosinophils, and asthma in childhood.
IL1RL1	Rs13431828	rs13431828 is a SNP in the Interleukin-1 receptor-like 1 IL1RL1 gene.206 adult patients with surgery-unresponsive chronic rhinosinusitis and 196 matched controls were used to conclude that several SNPs in the IL1RL1 gene appeared to be protective against this condition.
IL1RL1	Rs1420101	Interleukin-1 receptor-like 1 polymorphisms are associated with serum IL1RL1-a, eosinophils, and asthma in childhood.
IL1RN	Rs315952	Radiographic severity of knee osteoarthritis is conditional on Interleukin 1 Receptor Antagonist gene variations.
IL1RN	Rs423904	rs423904 increases susceptibility to Ulcerative colitis 2.60 times for carriers of the T allele.
IL1RN	Rs9005	Radiographic severity of knee osteoarthritis is conditional on Interleukin 1 Receptor Antagonist gene variations.
IL2	Rs2069772	Cervical and vulvar cancer risk in relation to the joint effects of cigarette smoking and genetic variation in interleukin 2.
IL20	Rs2981573	Evaluation of IL10, IL19 and IL20 gene polymorphisms and chronic hepatitis B infection outcome.
IL21	Rs907715	Confirmation of association of rs6822844 with rheumatoid arthritis at a genome-wide level of significance.
IL23R	Rs7517847	An investigation of genome-wide studies reported susceptibility loci for ulcerative colitis shows limited replication in north Indians.
IL23R	Rs11465770	Found that T allele may be protective against Crohns disease in Chinese.
IL23R	Rs7539625	Association of polymorphisms in the Interleukin 23 receptor gene with osteonecrosis of femoral head in Korean population.
IL23R	Rs1495965	Association study of IL10 and IL23R-IL12RB2 in Iranian patients with Behcets disease.
IL23R	Rs7530511	IL23R gene SNP, part of a haplotype with rs11209026 associated with psoriasis.In a study of 216 North American patients with Graves disease, the homozygous rs10889677 (T;T) genotype was significantly associated with Graves disease but not specifically with Graves ophthalmopathy; the odds ratio was 9.4 (p=0.02).
IL23R	Rs1343151	A;A homozygous individuals showed a strongly reduced risk of Crohns Disease compared those who were G;G homozygous.
IL23R	Rs11209032	The odds ratio is 1.3 (p=7.5x10e-9).PMID 17952073, PMID 18037607 rs11209032 and rs1495965 no significant association with systemic sclerosis.
IL23R	Rs11465804	rs11465804 is one of several SNPs in the IL23R gene that has been shown in a large (over 1,000 Caucasian patients) study to be associated with ankylosing spondylitis.
IL23R	Rs10889677	The odds ratio is 1.3 (p=1.3x10e-6).PMID 17952073, PMID 18037607In a study of 216 North American patients with Graves disease, the C allele of rs10889677 was 2.03x overrepresented (p=1.3x10<sup>&#226;&#8364;&#8220;4</sup>), and the homozygous rs10889677 (C;C) genotype was also overrepresented (2.36x; p=1.4x10<sup>-4</sup>) in Graves ophthalmopathy patients.A genome-wide association study using DNA samples from 1,052 individuals with ulcerative colitis and preexisting data from 2,571 controls, all of European ancestry, concluded that this SNP and several others were associated with altered risk for the disease.
IL23R	Rs10489629	rs10489629 is one of several SNPs in the IL23R gene that has been shown in a large (over 1,000 Caucasian patients) study to be associated with ankylosing spondylitis.
IL23R	Rs11805303	rs11805303 has been reported in a large study to be associated with Crohns disease.The risk allele (oriented to the dbSNP entry) is (T). the odds ratio associated with heterozygotes is 1.39 (CI 1.22-1.58), and for homozygotes, 1.86 (CI 1.54-2.24).
IL2RA	Rs3118470	Analysis of 19 genes for association with type I diabetes in the Type I Diabetes Genetics Consortium families.
IL2RA	Rs706778	rs706778 is mentioned as being strongly associated with type-1 diabetes in.
IL2RB	Rs743777	A novel galectin-1 and interleukin 2 receptor beta haplotype is associated with autoimmune myasthenia gravis.
IL31	Rs11608363	Three haplotypes comprised 94% of the haplotypes identified in a German group of patients, defined as follows:Haplotype A: rs6489188 (G) and rs11608363 (A) Haplotype B: rs6489188 (A) and rs11608363 (G) Haplotype C: rs6489188 (G) and rs11608363 (G) Individuals homozygous for haplotype A were strongly associated with nonatopic eczema compared to individuals not carrying that haplotype.
IL31	Rs6489188	Three haplotypes comprised 94% of the haplotypes identified in a German group of patients, defined as follows:Haplotype A: rs6489188 (G) and rs11608363 (A) Haplotype B: rs6489188 (A) and rs11608363 (G) Haplotype C: rs6489188 (G) and rs11608363 (G) Individuals homozygous for haplotype A were strongly associated with nonatopic eczema compared to individuals not carrying that haplotype.
IL4	Rs2243274	Analysis of 19 genes for association with type I diabetes in the Type I Diabetes Genetics Consortium families.
IL4	Rs2243266	Differences in candidate gene association between European ancestry and African American asthmatic children.
IL4	Rs2243268	Differences in candidate gene association between European ancestry and African American asthmatic children.
IL4	Rs2243250	rs2243250 is a SNP in the IL4 gene that is also known as the -589C>T SNP.In 300 patients younger than 50 years the rs2243250 (T) allele was associated with a reduced risk of myocardial infarction (odds ratio 0.57, CI: 0.34-0.95).
IL4	Rs2070874	rs2070874 is a SNP in the promoter region of the interleukin 4 IL4 gene.This SNP is one of five SNPs reported to be useful in a SNP set defining the risk of dying from prostate cancer among patients with the disease; see gs242 and gs243.
IL6	Rs7802307	rs7802307 coronary artery disease 190 affected Asian Indian sibling pairs.
IL6	Rs2069861	IL6 and CRP haplotypes are associated with COPD risk and systemic inflammation: a case-control study.
IL6	Rs2069837	The synergy factor (SF) was 1.63 (CI: 1.10-2.41, p = 0.01), controlling for age, gender and ApoE4 genotype.
IL6	Rs2069832	C-reactive protein, interleukin-6, and prostate cancer risk in men aged 65 years and older.
IL6	Rs2069832	Adipokine genes and prostate cancer risk.
IL6	Rs2069830	Stroke rs2069830 (T) (frequency = 5%) protective among non-smokers (OR = 0.30, 95% CI=0.11-.082, p=0.02), but not among smokers (OR = 1.63, 95% CI=0.48-5.58, p=0.43).
IL6	Rs7802308	rs7802308 coronary artery disease 190 affected Asian Indian sibling pairs.
IL6	Rs1800797	Carriage of the G-G diplotype indicated an increased risk of both symmetrical DIP OA (OR 1.52 95% CI 1.01 to 2.28) and symptomatic DIP OA (OR 3.67 95% CI 1.50 to 9.00) rs1800797 coronary artery disease 190 affected Asian Indian sibling pairs.
IL6	Rs1800796	Carriage of the G-G diplotype indicated an increased risk of both symmetrical DIP OA (OR 1.52 95% CI 1.01 to 2.28) and symptomatic DIP OA (OR 3.67 95% CI 1.50 to 9.00) rs1800796 coronary artery disease 190 affected Asian Indian sibling pairs.
IL6	Rs1524107	Association of genetic variation in serum amyloid-A with cardiovascular disease and interactions with IL6, IL1RN, IL1beta and TNF genes in the Cardiovascular Health Study.
IL6	Rs13447446	rs13447446 may be a misassigned reference for the IL6 gene rs1800795.
IL6	Rs13306435	A haplotype of the IL6 gene appears to be overrepresented in sciatica patients.PMID 15733644, PMID 18321738.
IL6	Rs2066992	rs2066992 coronary artery disease 190 affected Asian Indian sibling pairs.
IL6R	Rs6694817	Named in as a SNP potentially used in the calculation of a cardiovascular genetic risk score.
IL6R	Rs6684439	A study of 219 female melanoma patients and an equal number of controls concluded that 4 linked SNPs within the IL6R gene were associated with increased melanoma risk, but only when heterozygous.
IL6R	Rs4845617	Fatigued breast cancer survivors and gene polymorphisms in the inflammatory pathway.
IL6R	Rs4845617	Interleukin and interleukin receptor gene polymorphisms and susceptibility to melanoma.
IL6R	Rs4129267	A 2011 study of 302 Breast cancer survivors, and follow-up data from 236 of them, Fatigued breast cancer survivors and gene polymorphisms in the inflammatory pathway examined The associations between fatigue and SNPs in inflammation-related genes; IL1β ( rs16944 ), IL6 ( rs1800795 ), IL6receptor ( rs4129267, rs4845617, rs2228145 ), CRP ( rs2794521, rs3091244 )  (Abstract).
IL6R	Rs2229238	Inflammation and stress-related candidate genes, plasma interleukin-6 levels, and longevity in older adults.
IL6R	Rs12730935	Multi-ancestry genome-wide association study of 21,000 cases and 95,000 controls identifies new risk loci for atopic dermatitis.
IL6R	Rs4537545	Novel loci, including those related to Crohn disease, psoriasis, and inflammation, identified in a genome-wide association study of fibrinogen in 17 686 women: the Womens Genome Health Study.
IMMP2L	Rs12531640	Gwas, hit (p = 6 x 10^-6) for intra-extra dimensional set shift (IED) EDS errors in the CANTAB (Cambridge Neuropsychological Test Automated Battery).
IMPDH1	Rs72624951	Non-coding variant assessed as part of Blueprint Genetics Retinal dystrophy (266 gene) panel.
INSL6	Rs10815149	/ 23andMe blog rs10815149 (C) increased risk of myeloproliferative neoplasm due to stem cells over producing too many of one type of cell.
INSL6	Rs121912472	The (rare) rs121912472 (C) variant may be associated with certain myeloproliferative disorders.
INSL6	Rs3780378	Association of common JAK2 variants with body fat, insulin sensitivity and lipid profile.
INSL6	Rs77375493	The wild-type (normal) allele is rs77375493 (G), and the (very rare) variant allele is rs77375493 (T).While the predictive medical consequences of having the variant in the absence of symptoms remain uncertain, this variant has been reported to be associated with several myeloproliferative disorders (basically, cancers of the blood), including polycythemia vera, essential thrombocythemia, and idiopathic myelofibrosis, and it appears to be act in a dominant manner.
INSR	Rs2860174	A combined study totaling 1,000+ patients with migraine susceptibility concluded that even larger numbers of individuals are required to exclude or confirm the most likely small effect of rs2860174 on migraine susceptibility.
INSR	Rs1864010	The INSR A-603G promoter rs1864010 SNP, which is located within a known Sp1-binding site, was associated with the risk of colorectal cancer, with carriers of the G allele having a decreased risk (odds ratios 0.71, CI: 0.54-0.93).
IRAK1	Rs1059703	The C->T (Ser532Leu, rs1059703 ) polymorphism of the IRAK1 gene was significantly associated with atherothrombotic cerebral infarction in a study of 3,400+ Japanese adults.
IRAK3	Rs1882200	Assessing the reproducibility of asthma candidate gene associations, using genome-wide data.
IRF1	Rs2070729	Lack of association of interferon regulatory factor 1 with severe malaria in affected child-parental trio studies across three African populations.
IRF5	Rs10954213	Structural insertion/deletion variation in IRF5 is associated with a risk haplotype and defines the precise IRF5 isoforms expressed in systemic lupus erythematosus.
IRF5	Rs10954213	Association of the IRF5 risk haplotype with high serum interferon-alpha activity in systemic lupus erythematosus patients.
IRF5	Rs10954213	Evidence for genetic association and interaction between the TYK2 and IRF5 genes in systemic lupus erythematosus.
IRF5	Rs10954213	Promoter insertion/deletion in the IRF5 gene is highly associated with susceptibility to systemic lupus erythematosus in distinct populations, but exerts a modest effect on gene expression in peripheral blood mononuclear cells.
